A1: 科目名稱：703015001數位系統實驗
A2: 任課教師：廖文宏 教授
A3: 上課時間 / 教室：三78 / 大仁200201
A4: 系級 | B4: 學號 | C4: EXP1 | D4: EXP2 | E4: EXP3 | F4: EXP4 | G4: EXP5 | H4: EXP6 | I4: EXP7 | J4: 報告成績 | K4: 期末考 | L4: 總成績
A5: 應數四 | B5: 90207438 | C5: 80 | D5: 80 | E5: 78 | F5: 80 | G5: 80 | H5: 78 | I5: 78 | J5: =ROUND(AVERAGE(C5:I5),0) -> 79 | K5: 51 | L5: =(C5+D5+E5+F5+G5+H5+I5)*0.08+J5*0.25+K5*0.25 -> 76.82
A6: 資科二 | B6: 91703011 | C6: 0 | D6: 0 | E6: 0 | F6: 0 | G6: 0 | H6: 0 | I6: 0 | J6: 0 | K6: 0 | L6: =(C6+D6+E6+F6+G6+H6+I6)*0.08+J6*0.25+K6*0.25 -> 0
A7: 資科二 | B7: 91703026 | C7: 80 | D7: 78 | E7: 78 | F7: 78 | G7: 80 | H7: 78 | I7: 78 | J7: =ROUND(AVERAGE(C7:I7),0) -> 79 | K7: 70 | L7: =(C7+D7+E7+F7+G7+H7+I7)*0.08+J7*0.25+K7*0.25 -> 81.25
A8: 資科二 | B8: 92703001 | C8: 85 | D8: 88 | E8: 80 | F8: 80 | G8: 78 | H8: 76 | I8: 80 | J8: =ROUND(AVERAGE(C8:I8),0) -> 81 | K8: 66 | L8: =(C8+D8+E8+F8+G8+H8+I8)*0.08+J8*0.25+K8*0.25 -> 82.11
A9: 資科二 | B9: 92703003 | C9: 80 | D9: 85 | E9: 84 | F9: 80 | G9: 80 | H9: 78 | I9: 78 | J9: =ROUND(AVERAGE(C9:I9),0) -> 81 | K9: 63 | L9: =(C9+D9+E9+F9+G9+H9+I9)*0.08+J9*0.25+K9*0.25 -> 81.2
A10: 資科二 | B10: 92703004 | C10: 78 | D10: 83 | E10: 80 | F10: 78 | G10: 78 | H10: 76 | I10: 76 | J10: =ROUND(AVERAGE(C10:I10),0) -> 78 | K10: 55 | L10: =(C10+D10+E10+F10+G10+H10+I10)*0.08+J10*0.25+K10*0.25 -> 77.17
A11: 資科二 | B11: 92703005 | C11: 83 | D11: 78 | E11: 78 | F11: 80 | G11: 78 | H11: 76 | I11: 78 | J11: =ROUND(AVERAGE(C11:I11),0) -> 79 | K11: 20 | L11: =(C11+D11+E11+F11+G11+H11+I11)*0.08+J11*0.25+K11*0.25 -> 68.83
A12: 資科二 | B12: 92703006 | C12: 80 | D12: 78 | E12: 78 | F12: 78 | G12: 80 | H12: 78 | I12: 78 | J12: =ROUND(AVERAGE(C12:I12),0) -> 79 | K12: 63 | L12: =(C12+D12+E12+F12+G12+H12+I12)*0.08+J12*0.25+K12*0.25 -> 79.5
A13: 資科二 | B13: 92703007 | C13: 80 | D13: 83 | E13: 78 | F13: 78 | G13: 78 | H13: 76 | I13: 76 | J13: =ROUND(AVERAGE(C13:I13),0) -> 78 | K13: 45 | L13: =(C13+D13+E13+F13+G13+H13+I13)*0.08+J13*0.25+K13*0.25 -> 74.67
A14: 資科二 | B14: 92703008 | C14: 83 | D14: 78 | E14: 78 | F14: 78 | G14: 80 | H14: 76 | I14: 78 | J14: =ROUND(AVERAGE(C14:I14),0) -> 79 | K14: 67 | L14: =(C14+D14+E14+F14+G14+H14+I14)*0.08+J14*0.25+K14*0.25 -> 80.58
A15: 資科二 | B15: 92703009 | C15: 82 | D15: 80 | E15: 79 | F15: 78 | G15: 78 | H15: 78 | I15: 80 | J15: =ROUND(AVERAGE(C15:I15),0) -> 79 | K15: 65 | L15: =(C15+D15+E15+F15+G15+H15+I15)*0.08+J15*0.25+K15*0.25 -> 80.4
A16: 資科二 | B16: 92703010 | C16: 78 | D16: 83 | E16: 80 | F16: 78 | G16: 78 | H16: 76 | I16: 76 | J16: =ROUND(AVERAGE(C16:I16),0) -> 78 | K16: 46 | L16: =(C16+D16+E16+F16+G16+H16+I16)*0.08+J16*0.25+K16*0.25 -> 74.92
A17: 資科二 | B17: 92703011 | C17: 80 | D17: 83 | E17: 78 | F17: 78 | G17: 78 | H17: 76 | I17: 76 | J17: =ROUND(AVERAGE(C17:I17),0) -> 78 | K17: 52 | L17: =(C17+D17+E17+F17+G17+H17+I17)*0.08+J17*0.25+K17*0.25 -> 76.42
A18: 資科二 | B18: 92703012 | C18: 83 | D18: 78 | E18: 78 | F18: 80 | G18: 78 | H18: 76 | I18: 78 | J18: =ROUND(AVERAGE(C18:I18),0) -> 79 | K18: 63 | L18: =(C18+D18+E18+F18+G18+H18+I18)*0.08+J18*0.25+K18*0.25 -> 79.58
A19: 資科二 | B19: 92703013 | C19: 80 | D19: 80 | E19: 78 | F19: 80 | G19: 80 | H19: 78 | I19: 78 | J19: =ROUND(AVERAGE(C19:I19),0) -> 79 | K19: 46 | L19: =(C19+D19+E19+F19+G19+H19+I19)*0.08+J19*0.25+K19*0.25 -> 75.57
A20: 資科二 | B20: 92703014 | C20: 80 | D20: 80 | E20: 78 | F20: 80 | G20: 80 | H20: 78 | I20: 78 | J20: =ROUND(AVERAGE(C20:I20),0) -> 79 | K20: 54 | L20: =(C20+D20+E20+F20+G20+H20+I20)*0.08+J20*0.25+K20*0.25 -> 77.57
A21: 資科二 | B21: 92703015 | C21: 78 | D21: 83 | E21: 80 | F21: 78 | G21: 78 | H21: 76 | I21: 76 | J21: =ROUND(AVERAGE(C21:I21),0) -> 78 | K21: 54 | L21: =(C21+D21+E21+F21+G21+H21+I21)*0.08+J21*0.25+K21*0.25 -> 76.92
A22: 資科二 | B22: 92703016 | C22: 83 | D22: 78 | E22: 78 | F22: 78 | G22: 80 | H22: 76 | I22: 78 | J22: =ROUND(AVERAGE(C22:I22),0) -> 79 | K22: 4 | L22: =(C22+D22+E22+F22+G22+H22+I22)*0.08+J22*0.25+K22*0.25 -> 64.83
A23: 資科二 | B23: 92703017 | C23: 82 | D23: 80 | E23: 79 | F23: 78 | G23: 78 | H23: 78 | I23: 80 | J23: =ROUND(AVERAGE(C23:I23),0) -> 79 | K23: 55 | L23: =(C23+D23+E23+F23+G23+H23+I23)*0.08+J23*0.25+K23*0.25 -> 77.9
A24: 資科二 | B24: 92703018 | C24: 80 | D24: 80 | E24: 78 | F24: 80 | G24: 80 | H24: 78 | I24: 78 | J24: =ROUND(AVERAGE(C24:I24),0) -> 79 | K24: 36 | L24: =(C24+D24+E24+F24+G24+H24+I24)*0.08+J24*0.25+K24*0.25 -> 73.07
A25: 資科二 | B25: 92703019 | C25: 85 | D25: 88 | E25: 82 | F25: 83 | G25: 80 | H25: 80 | I25: 82 | J25: =ROUND(AVERAGE(C25:I25),0) -> 83 | K25: 76 | L25: =(C25+D25+E25+F25+G25+H25+I25)*0.08+J25*0.25+K25*0.25 -> 86.15
A26: 資科二 | B26: 92703020 | C26: 80 | D26: 78 | E26: 78 | F26: 78 | G26: 80 | H26: 78 | I26: 78 | J26: =ROUND(AVERAGE(C26:I26),0) -> 79 | K26: 62 | L26: =(C26+D26+E26+F26+G26+H26+I26)*0.08+J26*0.25+K26*0.25 -> 79.25
A27: 資科二 | B27: 92703021 | C27: 85 | D27: 88 | E27: 80 | F27: 80 | G27: 78 | H27: 76 | I27: 80 | J27: =ROUND(AVERAGE(C27:I27),0) -> 81 | K27: 89 | L27: =(C27+D27+E27+F27+G27+H27+I27)*0.08+J27*0.25+K27*0.25 -> 87.86
A28: 資科二 | B28: 92703022 | C28: 85 | D28: 88 | E28: 80 | F28: 80 | G28: 78 | H28: 76 | I28: 80 | J28: =ROUND(AVERAGE(C28:I28),0) -> 81 | K28: 89 | L28: =(C28+D28+E28+F28+G28+H28+I28)*0.08+J28*0.25+K28*0.25 -> 87.86
A29: 資科二 | B29: 92703023 | C29: 82 | D29: 80 | E29: 79 | F29: 78 | G29: 78 | H29: 78 | I29: 80 | J29: =ROUND(AVERAGE(C29:I29),0) -> 79 | K29: 70 | L29: =(C29+D29+E29+F29+G29+H29+I29)*0.08+J29*0.25+K29*0.25 -> 81.65
A30: 資科二 | B30: 92703024 | C30: 78 | D30: 80 | E30: 80 | F30: 78 | G30: 78 | H30: 80 | I30: 80 | J30: =ROUND(AVERAGE(C30:I30),0) -> 79 | K30: 68 | L30: =(C30+D30+E30+F30+G30+H30+I30)*0.08+J30*0.25+K30*0.25 -> 81.07
A31: 資科二 | B31: 92703025 | C31: 78 | D31: 80 | E31: 80 | F31: 78 | G31: 78 | H31: 80 | I31: 80 | J31: =ROUND(AVERAGE(C31:I31),0) -> 79 | K31: 54 | L31: =(C31+D31+E31+F31+G31+H31+I31)*0.08+J31*0.25+K31*0.25 -> 77.57
A32: 資科二 | B32: 92703026 | C32: 78 | D32: 80 | E32: 80 | F32: 78 | G32: 78 | H32: 80 | I32: 80 | J32: =ROUND(AVERAGE(C32:I32),0) -> 79 | K32: 41 | L32: =(C32+D32+E32+F32+G32+H32+I32)*0.08+J32*0.25+K32*0.25 -> 74.32
A33: 資科二 | B33: 92703027 | C33: 82 | D33: 80 | E33: 79 | F33: 78 | G33: 78 | H33: 78 | I33: 80 | J33: =ROUND(AVERAGE(C33:I33),0) -> 79 | K33: 42 | L33: 65
A34: 資科二 | B34: 92703028 | C34: 83 | D34: 78 | E34: 78 | F34: 80 | G34: 78 | H34: 76 | I34: 78 | J34: =ROUND(AVERAGE(C34:I34),0) -> 79 | K34: 73 | L34: =(C34+D34+E34+F34+G34+H34+I34)*0.08+J34*0.25+K34*0.25 -> 82.08
A35: 資科二 | B35: 92703029 | C35: 80 | D35: 83 | E35: 78 | F35: 78 | G35: 78 | H35: 76 | I35: 76 | J35: =ROUND(AVERAGE(C35:I35),0) -> 78 | K35: 66 | L35: =(C35+D35+E35+F35+G35+H35+I35)*0.08+J35*0.25+K35*0.25 -> 79.92
A36: 資科二 | B36: 92703030 | C36: 78 | D36: 76 | E36: 78 | F36: 78 | G36: 78 | H36: 78 | I36: 78 | J36: =ROUND(AVERAGE(C36:I36),0) -> 78 | K36: 34 | L36: 67
A37: 資科二 | B37: 92703032 | C37: 85 | D37: 88 | E37: 80 | F37: 80 | G37: 78 | H37: 76 | I37: 80 | J37: =ROUND(AVERAGE(C37:I37),0) -> 81 | K37: 57 | L37: =(C37+D37+E37+F37+G37+H37+I37)*0.08+J37*0.25+K37*0.25 -> 79.86
A38: 資科二 | B38: 92703033 | C38: 80 | D38: 78 | E38: 80 | F38: 78 | G38: 78 | H38: 78 | I38: 80 | J38: =ROUND(AVERAGE(C38:I38),0) -> 79 | K38: 50 | L38: =(C38+D38+E38+F38+G38+H38+I38)*0.08+J38*0.25+K38*0.25 -> 76.41
A39: 資科二 | B39: 92703034 | C39: 80 | D39: 85 | E39: 84 | F39: 80 | G39: 80 | H39: 78 | I39: 78 | J39: =ROUND(AVERAGE(C39:I39),0) -> 81 | K39: 73 | L39: =(C39+D39+E39+F39+G39+H39+I39)*0.08+J39*0.25+K39*0.25 -> 83.7
A40: 資科二 | B40: 92703035 | C40: 83 | D40: 78 | E40: 78 | F40: 80 | G40: 78 | H40: 76 | I40: 78 | J40: =ROUND(AVERAGE(C40:I40),0) -> 79 | K40: 61 | L40: =(C40+D40+E40+F40+G40+H40+I40)*0.08+J40*0.25+K40*0.25 -> 79.08
A41: 資科二 | B41: 92703036 | C41: 78 | D41: 76 | E41: 78 | F41: 78 | G41: 78 | H41: 78 | I41: 78 | J41: =ROUND(AVERAGE(C41:I41),0) -> 78 | K41: 51 | L41: =(C41+D41+E41+F41+G41+H41+I41)*0.08+J41*0.25+K41*0.25 -> 75.77
A42: 資科二 | B42: 92703037 | C42: 80 | D42: 83 | E42: 78 | F42: 78 | G42: 78 | H42: 76 | I42: 76 | J42: =ROUND(AVERAGE(C42:I42),0) -> 78 | K42: 57 | L42: =(C42+D42+E42+F42+G42+H42+I42)*0.08+J42*0.25+K42*0.25 -> 77.67
A43: 資科二 | B43: 92703038 | C43: 80 | D43: 78 | E43: 80 | F43: 78 | G43: 78 | H43: 78 | I43: 80 | J43: =ROUND(AVERAGE(C43:I43),0) -> 79 | K43: 49 | L43: =(C43+D43+E43+F43+G43+H43+I43)*0.08+J43*0.25+K43*0.25 -> 76.16
A44: 資科二 | B44: 92703039 | C44: 80 | D44: 78 | E44: 80 | F44: 78 | G44: 78 | H44: 78 | I44: 80 | J44: =ROUND(AVERAGE(C44:I44),0) -> 79 | K44: 58 | L44: =(C44+D44+E44+F44+G44+H44+I44)*0.08+J44*0.25+K44*0.25 -> 78.41
A45: 資科二 | B45: 92703040 | C45: 78 | D45: 80 | E45: 80 | F45: 78 | G45: 78 | H45: 80 | I45: 80 | J45: =ROUND(AVERAGE(C45:I45),0) -> 79 | K45: 71 | L45: =(C45+D45+E45+F45+G45+H45+I45)*0.08+J45*0.25+K45*0.25 -> 81.82
A46: 資科二 | B46: 92703041 | C46: 78 | D46: 83 | E46: 80 | F46: 78 | G46: 78 | H46: 76 | I46: 76 | J46: =ROUND(AVERAGE(C46:I46),0) -> 78 | K46: 61 | L46: =(C46+D46+E46+F46+G46+H46+I46)*0.08+J46*0.25+K46*0.25 -> 78.67
A47: 資科二 | B47: 92703042 | C47: 80 | D47: 85 | E47: 84 | F47: 80 | G47: 80 | H47: 78 | I47: 78 | J47: =ROUND(AVERAGE(C47:I47),0) -> 81 | K47: 75 | L47: =(C47+D47+E47+F47+G47+H47+I47)*0.08+J47*0.25+K47*0.25 -> 84.2
A48: 資科二 | B48: 92703043 | C48: 78 | D48: 76 | E48: 78 | F48: 78 | G48: 78 | H48: 78 | I48: 78 | J48: =ROUND(AVERAGE(C48:I48),0) -> 78 | K48: 58 | L48: =(C48+D48+E48+F48+G48+H48+I48)*0.08+J48*0.25+K48*0.25 -> 77.52
A49: 資科二 | B49: 92703044 | C49: 80 | D49: 85 | E49: 84 | F49: 80 | G49: 80 | H49: 78 | I49: 78 | J49: =ROUND(AVERAGE(C49:I49),0) -> 81 | K49: 37 | L49: 70
A50: 資科二 | B50: 92703045 | C50: 85 | D50: 88 | E50: 82 | F50: 83 | G50: 80 | H50: 80 | I50: 82 | J50: =ROUND(AVERAGE(C50:I50),0) -> 83 | K50: 50 | L50: =(C50+D50+E50+F50+G50+H50+I50)*0.08+J50*0.25+K50*0.25 -> 79.65
A51: 資科二 | B51: 92703047 | C51: 85 | D51: 88 | E51: 82 | F51: 83 | G51: 80 | H51: 80 | I51: 82 | J51: =ROUND(AVERAGE(C51:I51),0) -> 83 | K51: 47 | L51: =(C51+D51+E51+F51+G51+H51+I51)*0.08+J51*0.25+K51*0.25 -> 78.9
A52: 資科二 | B52: 92703048 | C52: 83 | D52: 78 | E52: 78 | F52: 78 | G52: 80 | H52: 76 | I52: 78 | J52: =ROUND(AVERAGE(C52:I52),0) -> 79 | K52: 42 | L52: =(C52+D52+E52+F52+G52+H52+I52)*0.08+J52*0.25+K52*0.25 -> 74.33
A53: 資科二 | B53: 92703049 | C53: 80 | D53: 78 | E53: 80 | F53: 78 | G53: 78 | H53: 78 | I53: 80 | J53: =ROUND(AVERAGE(C53:I53),0) -> 79 | K53: 68 | L53: =(C53+D53+E53+F53+G53+H53+I53)*0.08+J53*0.25+K53*0.25 -> 80.91
A54: 資科二 | B54: 92703051 | C54: 80 | D54: 78 | E54: 78 | F54: 78 | G54: 80 | H54: 78 | I54: 78 | J54: =ROUND(AVERAGE(C54:I54),0) -> 79 | K54: 55 | L54: =(C54+D54+E54+F54+G54+H54+I54)*0.08+J54*0.25+K54*0.25 -> 77.5
A55: 資科三 | B55: 91703048 | C55: 83 | D55: 78 | E55: 78 | F55: 78 | G55: 80 | H55: 76 | I55: 78 | J55: =ROUND(AVERAGE(C55:I55),0) -> 79 | K55: 44 | L55: =(C55+D55+E55+F55+G55+H55+I55)*0.08+J55*0.25+K55*0.25 -> 74.83
A56: 資科四 | B56: 87703035 | C56: 0 | D56: 0 | E56: 0 | F56: 0 | G56: 0 | H56: 0 | I56: 0 | J56: 0 | K56: 0 | L56: =(C56+D56+E56+F56+G56+H56+I56)*0.08+J56*0.25+K56*0.25 -> 0
A57: 資科碩 | B57: 92753031 | C57: 85 | D57: 88 | E57: 82 | F57: 83 | G57: 80 | H57: 80 | I57: 82 | J57: =ROUND(AVERAGE(C57:I57),0) -> 83 | K57: 74 | L57: =(C57+D57+E57+F57+G57+H57+I57)*0.08+J57*0.25+K57*0.25 -> 85.65