A1: 科目名稱：703014001數位系統實習 成績 | E1: 實習一 | G1: 實習二 | J1: 實習三 | M1: 實習四 | P1: 實習五 | S1: 實習六 | V1: 實習七 | Y1: 期末考
A2: 序號 | B2: 系級 | C2: 學號 | D2: 組別 | E2: DEMO | F2: 結報 | G2: 預報 | H2: DEMO | I2: 結報 | J2: 預報 | K2: DEMO | L2: 結報 | M2: 預報 | N2: DEMO | O2: 結報 | P2: 預報 | Q2: DEMO | R2: 結報 | S2: 預報 | T2: DEMO | U2: 結報 | V2: 預報 | W2: DEMO | X2: 結報 | Z2: 總成績
A3: 1 | B3: 會二乙 | C3: 94703030 | D3: 1 | E3: 90 | F3: 90 | G3: 90 | H3: 90 | I3: 100 | J3: 95 | K3: 100 | L3: 90 | M3: 95 | N3: 90 | O3: 80 | P3: 95 | Q3: 80 | R3: 75 | S3: 95 | T3: 90 | U3: 85 | V3: 95 | W3: 60 | X3: 85 | Y3: 71 | Z3: =(G3+J3+M3+P3+S3+T3+V3)*0.02+(E3+H3+K3+N3+Q3+T3+W3)*0.04+(F3+I3+L3+O3+R3+U3+X3)*0.04+Y3*0.32 -> 84.02
A4: 10 | B4: 資科二 | C4: 94703010 | D4: 1 | E4: 90 | F4: 90 | G4: 90 | H4: 90 | I4: 100 | J4: 95 | K4: 100 | L4: 90 | M4: 95 | N4: 90 | O4: 80 | P4: 95 | Q4: 80 | R4: 75 | S4: 95 | T4: 90 | U4: 85 | V4: 95 | W4: 60 | X4: 85 | Y4: 56 | Z4: =(G4+J4+M4+P4+S4+T4+V4)*0.02+(E4+H4+K4+N4+Q4+T4+W4)*0.04+(F4+I4+L4+O4+R4+U4+X4)*0.04+Y4*0.32 -> 79.22
A5: 13 | B5: 資科二 | C5: 94703013 | D5: 1 | E5: 90 | F5: 90 | G5: 90 | H5: 90 | I5: 100 | J5: 95 | K5: 100 | L5: 90 | M5: 95 | N5: 90 | O5: 80 | P5: 95 | Q5: 80 | R5: 75 | S5: 95 | T5: 90 | U5: 85 | V5: 95 | W5: 60 | X5: 85 | Y5: 66 | Z5: =(G5+J5+M5+P5+S5+T5+V5)*0.02+(E5+H5+K5+N5+Q5+T5+W5)*0.04+(F5+I5+L5+O5+R5+U5+X5)*0.04+Y5*0.32 -> 82.42
A6: 29 | B6: 資科二 | C6: 94703034 | D6: 1 | E6: 90 | F6: 90 | G6: 90 | H6: 90 | I6: 100 | J6: 95 | K6: 100 | L6: 90 | M6: 95 | N6: 90 | O6: 80 | P6: 95 | Q6: 80 | R6: 75 | S6: 95 | T6: 90 | U6: 85 | V6: 95 | W6: 60 | X6: 85 | Y6: 41 | Z6: =(G6+J6+M6+P6+S6+T6+V6)*0.02+(E6+H6+K6+N6+Q6+T6+W6)*0.04+(F6+I6+L6+O6+R6+U6+X6)*0.04+Y6*0.32 -> 74.42
A7: 19 | B7: 資科二 | C7: 94703022 | D7: 2 | E7: 85 | F7: 90 | G7: 90 | H7: 70 | I7: 95 | J7: 95 | K7: 95 | L7: 85 | M7: 95 | N7: 90 | O7: 85 | P7: 95 | Q7: 50 | R7: 85 | S7: 95 | T7: 90 | U7: 75 | V7: 95 | W7: 90 | X7: 85 | Y7: 41 | Z7: =(G7+J7+M7+P7+S7+T7+V7)*0.02+(E7+H7+K7+N7+Q7+T7+W7)*0.04+(F7+I7+L7+O7+R7+U7+X7)*0.04+Y7*0.32 -> 73.02
A8: 23 | B8: 資科二 | C8: 94703026 | D8: 2 | E8: 85 | F8: 90 | G8: 90 | H8: 70 | I8: 95 | J8: 95 | K8: 95 | L8: 85 | M8: 95 | N8: 90 | O8: 85 | P8: 95 | Q8: 50 | R8: 85 | S8: 95 | T8: 90 | U8: 75 | V8: 95 | W8: 90 | X8: 85 | Y8: 71 | Z8: =(G8+J8+M8+P8+S8+T8+V8)*0.02+(E8+H8+K8+N8+Q8+T8+W8)*0.04+(F8+I8+L8+O8+R8+U8+X8)*0.04+Y8*0.32 -> 82.62
A9: 28 | B9: 資科二 | C9: 94703033 | D9: 2 | E9: 85 | F9: 90 | G9: 90 | H9: 70 | I9: 95 | J9: 95 | K9: 95 | L9: 85 | M9: 95 | N9: 90 | O9: 85 | P9: 95 | Q9: 50 | R9: 85 | S9: 95 | T9: 90 | U9: 75 | V9: 95 | W9: 90 | X9: 85 | Y9: 46 | Z9: =(G9+J9+M9+P9+S9+T9+V9)*0.02+(E9+H9+K9+N9+Q9+T9+W9)*0.04+(F9+I9+L9+O9+R9+U9+X9)*0.04+Y9*0.32 -> 74.62
A10: 37 | B10: 資科二 | C10: 94703051 | D10: 2 | E10: 85 | F10: 90 | G10: 90 | H10: 70 | I10: 95 | J10: 95 | K10: 95 | L10: 85 | M10: 95 | N10: 90 | O10: 85 | P10: 95 | Q10: 50 | R10: 85 | S10: 95 | T10: 90 | U10: 75 | V10: 95 | W10: 90 | X10: 85 | Y10: 71 | Z10: =(G10+J10+M10+P10+S10+T10+V10)*0.02+(E10+H10+K10+N10+Q10+T10+W10)*0.04+(F10+I10+L10+O10+R10+U10+X10)*0.04+Y10*0.32 -> 82.62
A11: 3 | B11: 資科二 | C11: 94703002 | D11: 3 | E11: 100 | F11: 100 | G11: 90 | H11: 90 | I11: 95 | J11: 100 | K11: 100 | L11: 90 | M11: 100 | N11: 90 | O11: 90 | P11: 95 | Q11: 90 | R11: 90 | S11: 95 | T11: 90 | U11: 90 | V11: 95 | W11: 90 | X11: 90 | Y11: 75 | Z11: =(G11+J11+M11+P11+S11+T11+V11)*0.02+(E11+H11+K11+N11+Q11+T11+W11)*0.04+(F11+I11+L11+O11+R11+U11+X11)*0.04+Y11*0.32 -> 89.1
A12: 6 | B12: 資科二 | C12: 94703006 | D12: 3 | E12: 100 | F12: 100 | G12: 90 | H12: 90 | I12: 95 | J12: 100 | K12: 100 | L12: 90 | M12: 100 | N12: 90 | O12: 90 | P12: 95 | Q12: 90 | R12: 90 | S12: 95 | T12: 90 | U12: 90 | V12: 95 | W12: 90 | X12: 90 | Y12: 75 | Z12: =(G12+J12+M12+P12+S12+T12+V12)*0.02+(E12+H12+K12+N12+Q12+T12+W12)*0.04+(F12+I12+L12+O12+R12+U12+X12)*0.04+Y12*0.32 -> 89.1
A13: 8 | B13: 資科二 | C13: 94703008 | D13: 3 | E13: 100 | F13: 100 | G13: 90 | H13: 90 | I13: 95 | J13: 100 | K13: 100 | L13: 90 | M13: 100 | N13: 90 | O13: 90 | P13: 95 | Q13: 90 | R13: 90 | S13: 95 | T13: 90 | U13: 90 | V13: 95 | W13: 90 | X13: 90 | Y13: 71 | Z13: =(G13+J13+M13+P13+S13+T13+V13)*0.02+(E13+H13+K13+N13+Q13+T13+W13)*0.04+(F13+I13+L13+O13+R13+U13+X13)*0.04+Y13*0.32 -> 87.82
A14: 26 | B14: 資科二 | C14: 94703031 | D14: 3 | E14: 100 | F14: 100 | G14: 90 | H14: 90 | I14: 95 | J14: 100 | K14: 100 | L14: 90 | M14: 100 | N14: 90 | O14: 90 | P14: 95 | Q14: 90 | R14: 90 | S14: 95 | T14: 90 | U14: 90 | V14: 95 | W14: 90 | X14: 90 | Y14: 41 | Z14: =(G14+J14+M14+P14+S14+T14+V14)*0.02+(E14+H14+K14+N14+Q14+T14+W14)*0.04+(F14+I14+L14+O14+R14+U14+X14)*0.04+Y14*0.32 -> 78.22
A15: 2 | B15: 資科二 | C15: 94703001 | D15: 4 | E15: 90 | F15: 90 | G15: 90 | H15: 100 | I15: 95 | J15: 95 | K15: 100 | L15: 85 | M15: 95 | N15: 90 | O15: 80 | P15: 95 | Q15: 90 | R15: 80 | S15: 95 | T15: 90 | U15: 80 | V15: 95 | W15: 90 | X15: 85 | Y15: 71 | Z15: =(G15+J15+M15+P15+S15+T15+V15)*0.02+(E15+H15+K15+N15+Q15+T15+W15)*0.04+(F15+I15+L15+O15+R15+U15+X15)*0.04+Y15*0.32 -> 85.62
A16: 7 | B16: 資科二 | C16: 94703007 | D16: 4 | E16: 90 | F16: 90 | G16: 90 | H16: 100 | I16: 95 | J16: 95 | K16: 100 | L16: 85 | M16: 95 | N16: 90 | O16: 80 | P16: 95 | Q16: 90 | R16: 80 | S16: 95 | T16: 90 | U16: 80 | V16: 95 | W16: 90 | X16: 85 | Y16: 76 | Z16: =(G16+J16+M16+P16+S16+T16+V16)*0.02+(E16+H16+K16+N16+Q16+T16+W16)*0.04+(F16+I16+L16+O16+R16+U16+X16)*0.04+Y16*0.32 -> 87.22
A17: 30 | B17: 資科二 | C17: 94703035 | D17: 4 | E17: 90 | F17: 90 | G17: 90 | H17: 100 | I17: 95 | J17: 95 | K17: 100 | L17: 85 | M17: 95 | N17: 90 | O17: 80 | P17: 95 | Q17: 90 | R17: 80 | S17: 95 | T17: 90 | U17: 80 | V17: 95 | W17: 90 | X17: 85 | Y17: 81 | Z17: =(G17+J17+M17+P17+S17+T17+V17)*0.02+(E17+H17+K17+N17+Q17+T17+W17)*0.04+(F17+I17+L17+O17+R17+U17+X17)*0.04+Y17*0.32 -> 88.82
A18: 35 | B18: 資科二 | C18: 94703042 | D18: 4 | E18: 90 | F18: 90 | G18: 90 | H18: 100 | I18: 95 | J18: 95 | K18: 100 | L18: 85 | M18: 95 | N18: 90 | O18: 80 | P18: 95 | Q18: 90 | R18: 80 | S18: 95 | T18: 90 | U18: 80 | V18: 95 | W18: 90 | X18: 85 | Y18: 75 | Z18: =(G18+J18+M18+P18+S18+T18+V18)*0.02+(E18+H18+K18+N18+Q18+T18+W18)*0.04+(F18+I18+L18+O18+R18+U18+X18)*0.04+Y18*0.32 -> 86.9
A19: 4 | B19: 資科二 | C19: 94703003 | D19: 5 | E19: 90 | F19: 80 | G19: 100 | H19: 90 | I19: 95 | J19: 95 | K19: 100 | L19: 85 | M19: 95 | N19: 90 | O19: 90 | P19: 95 | Q19: 90 | R19: 85 | S19: 95 | T19: 90 | U19: 85 | V19: 95 | W19: 90 | X19: 75 | Y19: 71 | Z19: =(G19+J19+M19+P19+S19+T19+V19)*0.02+(E19+H19+K19+N19+Q19+T19+W19)*0.04+(F19+I19+L19+O19+R19+U19+X19)*0.04+Y19*0.32 -> 85.42
A20: 5 | B20: 資科二 | C20: 94703005 | D20: 5 | E20: 90 | F20: 80 | G20: 100 | H20: 90 | I20: 95 | J20: 95 | K20: 100 | L20: 85 | M20: 95 | N20: 90 | O20: 90 | P20: 95 | Q20: 90 | R20: 85 | S20: 95 | T20: 90 | U20: 85 | V20: 95 | W20: 90 | X20: 75 | Y20: 71 | Z20: =(G20+J20+M20+P20+S20+T20+V20)*0.02+(E20+H20+K20+N20+Q20+T20+W20)*0.04+(F20+I20+L20+O20+R20+U20+X20)*0.04+Y20*0.32 -> 85.42
A21: 34 | B21: 資科二 | C21: 94703040 | D21: 5 | E21: 90 | F21: 80 | G21: 100 | H21: 90 | I21: 95 | J21: 95 | K21: 100 | L21: 85 | M21: 95 | N21: 90 | O21: 90 | P21: 95 | Q21: 90 | R21: 85 | S21: 95 | T21: 90 | U21: 85 | V21: 95 | W21: 90 | X21: 75 | Y21: 61 | Z21: =(G21+J21+M21+P21+S21+T21+V21)*0.02+(E21+H21+K21+N21+Q21+T21+W21)*0.04+(F21+I21+L21+O21+R21+U21+X21)*0.04+Y21*0.32 -> 82.22
A22: 20 | B22: 資科二 | C22: 94703023 | D22: 6 | E22: 90 | F22: 90 | G22: 90 | H22: 90 | I22: 95 | J22: 95 | K22: 100 | L22: 85 | M22: 95 | N22: 90 | O22: 95 | P22: 95 | Q22: 90 | R22: 90 | S22: 95 | T22: 90 | U22: 85 | V22: 95 | W22: 90 | X22: 85 | Y22: 71 | Z22: =(G22+J22+M22+P22+S22+T22+V22)*0.02+(E22+H22+K22+N22+Q22+T22+W22)*0.04+(F22+I22+L22+O22+R22+U22+X22)*0.04+Y22*0.32 -> 86.42
A23: 31 | B23: 資科二 | C23: 94703036 | D23: 6 | E23: 90 | F23: 90 | G23: 90 | H23: 90 | I23: 95 | J23: 95 | K23: 100 | L23: 85 | M23: 95 | N23: 90 | O23: 95 | P23: 95 | Q23: 90 | R23: 90 | S23: 95 | T23: 90 | U23: 85 | V23: 95 | W23: 90 | X23: 85 | Y23: 71 | Z23: =(G23+J23+M23+P23+S23+T23+V23)*0.02+(E23+H23+K23+N23+Q23+T23+W23)*0.04+(F23+I23+L23+O23+R23+U23+X23)*0.04+Y23*0.32 -> 86.42
A24: 32 | B24: 資科二 | C24: 94703037 | D24: 6 | E24: 90 | F24: 90 | G24: 90 | H24: 90 | I24: 95 | J24: 95 | K24: 100 | L24: 85 | M24: 95 | N24: 90 | O24: 95 | P24: 95 | Q24: 90 | R24: 90 | S24: 95 | T24: 90 | U24: 85 | V24: 95 | W24: 90 | X24: 85 | Y24: 71 | Z24: =(G24+J24+M24+P24+S24+T24+V24)*0.02+(E24+H24+K24+N24+Q24+T24+W24)*0.04+(F24+I24+L24+O24+R24+U24+X24)*0.04+Y24*0.32 -> 86.42
A25: 38 | B25: 資科三 | C25: 93703030 | D25: 6 | E25: 90 | F25: 90 | G25: 90 | H25: 90 | I25: 95 | J25: 95 | K25: 100 | L25: 85 | M25: 95 | N25: 90 | O25: 95 | P25: 95 | Q25: 90 | R25: 90 | S25: 95 | T25: 90 | U25: 85 | V25: 95 | W25: 90 | X25: 85 | Y25: 41 | Z25: =(G25+J25+M25+P25+S25+T25+V25)*0.02+(E25+H25+K25+N25+Q25+T25+W25)*0.04+(F25+I25+L25+O25+R25+U25+X25)*0.04+Y25*0.32 -> 76.82
A26: 18 | B26: 資科二 | C26: 94703021 | D26: 7 | E26: 90 | F26: 100 | G26: 100 | H26: 90 | I26: 95 | J26: 95 | K26: 100 | L26: 85 | M26: 95 | N26: 90 | O26: 90 | P26: 95 | Q26: 0 | R26: 75 | S26: 95 | T26: 90 | U26: 75 | V26: 95 | W26: 90 | X26: 75 | Y26: 71 | Z26: =(G26+J26+M26+P26+S26+T26+V26)*0.02+(E26+H26+K26+N26+Q26+T26+W26)*0.04+(F26+I26+L26+O26+R26+U26+X26)*0.04+Y26*0.32 -> 81.82
A27: 21 | B27: 資科二 | C27: 94703024 | D27: 7 | E27: 90 | F27: 100 | G27: 100 | H27: 90 | I27: 95 | J27: 95 | K27: 100 | L27: 85 | M27: 95 | N27: 90 | O27: 90 | P27: 95 | Q27: 0 | R27: 75 | S27: 95 | T27: 90 | U27: 75 | V27: 95 | W27: 90 | X27: 75 | Y27: 66 | Z27: =(G27+J27+M27+P27+S27+T27+V27)*0.02+(E27+H27+K27+N27+Q27+T27+W27)*0.04+(F27+I27+L27+O27+R27+U27+X27)*0.04+Y27*0.32 -> 80.22
A28: 25 | B28: 資科二 | C28: 94703029 | D28: 7 | E28: 90 | F28: 100 | G28: 100 | H28: 90 | I28: 95 | J28: 95 | K28: 100 | L28: 85 | M28: 95 | N28: 90 | O28: 90 | P28: 95 | Q28: 0 | R28: 75 | S28: 95 | T28: 90 | U28: 75 | V28: 95 | W28: 90 | X28: 75 | Y28: 55 | Z28: =(G28+J28+M28+P28+S28+T28+V28)*0.02+(E28+H28+K28+N28+Q28+T28+W28)*0.04+(F28+I28+L28+O28+R28+U28+X28)*0.04+Y28*0.32 -> 76.7
A29: 11 | B29: 資科二 | C29: 94703011 | D29: 8 | E29: 80 | F29: 80 | G29: 90 | H29: 70 | I29: 95 | J29: 95 | K29: 100 | L29: 75 | M29: 95 | N29: 80 | O29: 80 | P29: 95 | Q29: 60 | R29: 75 | S29: 95 | T29: 80 | U29: 75 | V29: 95 | W29: 80 | X29: 75 | Y29: 45 | Z29: =(G29+J29+M29+P29+S29+T29+V29)*0.02+(E29+H29+K29+N29+Q29+T29+W29)*0.04+(F29+I29+L29+O29+R29+U29+X29)*0.04+Y29*0.32 -> 71.5
A30: 12 | B30: 資科二 | C30: 94703012 | D30: 8 | E30: 80 | F30: 80 | G30: 90 | H30: 70 | I30: 95 | J30: 95 | K30: 100 | L30: 75 | M30: 95 | N30: 80 | O30: 80 | P30: 95 | Q30: 60 | R30: 75 | S30: 95 | T30: 80 | U30: 75 | V30: 95 | W30: 80 | X30: 75 | Y30: 75 | Z30: =(G30+J30+M30+P30+S30+T30+V30)*0.02+(E30+H30+K30+N30+Q30+T30+W30)*0.04+(F30+I30+L30+O30+R30+U30+X30)*0.04+Y30*0.32 -> 81.1
A31: 16 | B31: 資科二 | C31: 94703019 | D31: 8 | E31: 80 | F31: 80 | G31: 90 | H31: 70 | I31: 95 | J31: 95 | K31: 100 | L31: 75 | M31: 95 | N31: 80 | O31: 80 | P31: 95 | Q31: 60 | R31: 75 | S31: 95 | T31: 80 | U31: 75 | V31: 95 | W31: 80 | X31: 75 | Y31: 76 | Z31: =(G31+J31+M31+P31+S31+T31+V31)*0.02+(E31+H31+K31+N31+Q31+T31+W31)*0.04+(F31+I31+L31+O31+R31+U31+X31)*0.04+Y31*0.32 -> 81.42
A32: 36 | B32: 資科二 | C32: 94703043 | D32: 8 | E32: 0 | F32: 0 | G32: 0 | H32: 0 | I32: 0 | J32: 0 | K32: 0 | L32: 0 | M32: 0 | N32: 0 | O32: 0 | P32: 0 | Q32: 0 | R32: 0 | S32: 0 | T32: 0 | U32: 0 | V32: 0 | W32: 0 | X32: 0 | Y32: 0 | Z32: =(G32+J32+M32+P32+S32+T32+V32)*0.02+(E32+H32+K32+N32+Q32+T32+W32)*0.04+(F32+I32+L32+O32+R32+U32+X32)*0.04+Y32*0.32 -> 0
A33: 9 | B33: 資科二 | C33: 94703009 | D33: 9 | E33: 85 | F33: 70 | G33: 90 | H33: 90 | I33: 95 | J33: 100 | K33: 100 | L33: 85 | M33: 95 | N33: 90 | O33: 95 | P33: 95 | Q33: 60 | R33: 85 | S33: 100 | T33: 90 | U33: 90 | V33: 95 | W33: 0 | X33: 85 | Y33: 51 | Z33: =(G33+J33+M33+P33+S33+T33+V33)*0.02+(E33+H33+K33+N33+Q33+T33+W33)*0.04+(F33+I33+L33+O33+R33+U33+X33)*0.04+Y33*0.32 -> 74.42
A34: 22 | B34: 資科二 | C34: 94703025 | D34: 9 | E34: 85 | F34: 70 | G34: 90 | H34: 90 | I34: 95 | J34: 100 | K34: 100 | L34: 85 | M34: 95 | N34: 90 | O34: 95 | P34: 95 | Q34: 60 | R34: 85 | S34: 100 | T34: 90 | U34: 90 | V34: 95 | W34: 0 | X34: 85 | Y34: 71 | Z34: =(G34+J34+M34+P34+S34+T34+V34)*0.02+(E34+H34+K34+N34+Q34+T34+W34)*0.04+(F34+I34+L34+O34+R34+U34+X34)*0.04+Y34*0.32 -> 80.82
A35: 27 | B35: 資科二 | C35: 94703032 | D35: 9 | E35: 85 | F35: 70 | G35: 90 | H35: 90 | I35: 95 | J35: 100 | K35: 100 | L35: 85 | M35: 95 | N35: 90 | O35: 95 | P35: 95 | Q35: 60 | R35: 85 | S35: 100 | T35: 90 | U35: 90 | V35: 95 | W35: 0 | X35: 85 | Y35: 41 | Z35: =(G35+J35+M35+P35+S35+T35+V35)*0.02+(E35+H35+K35+N35+Q35+T35+W35)*0.04+(F35+I35+L35+O35+R35+U35+X35)*0.04+Y35*0.32 -> 71.22
A36: 33 | B36: 資科二 | C36: 94703038 | D36: 9 | E36: 85 | F36: 70 | G36: 90 | H36: 90 | I36: 95 | J36: 100 | K36: 100 | L36: 85 | M36: 95 | N36: 90 | O36: 95 | P36: 95 | Q36: 60 | R36: 85 | S36: 100 | T36: 90 | U36: 90 | V36: 95 | W36: 0 | X36: 85 | Y36: 41 | Z36: =(G36+J36+M36+P36+S36+T36+V36)*0.02+(E36+H36+K36+N36+Q36+T36+W36)*0.04+(F36+I36+L36+O36+R36+U36+X36)*0.04+Y36*0.32 -> 71.22
A37: 14 | B37: 資科二 | C37: 94703016 | D37: 10 | E37: 90 | F37: 90 | G37: 90 | H37: 90 | I37: 95 | J37: 95 | K37: 100 | L37: 95 | M37: 95 | N37: 90 | O37: 85 | P37: 95 | Q37: 90 | R37: 100 | S37: 100 | T37: 90 | U37: 80 | V37: 95 | W37: 80 | X37: 80 | Y37: 56 | Z37: =(G37+J37+M37+P37+S37+T37+V37)*0.02+(E37+H37+K37+N37+Q37+T37+W37)*0.04+(F37+I37+L37+O37+R37+U37+X37)*0.04+Y37*0.32 -> 81.32
A38: 15 | B38: 資科二 | C38: 94703017 | D38: 10 | E38: 90 | F38: 90 | G38: 90 | H38: 90 | I38: 95 | J38: 95 | K38: 100 | L38: 95 | M38: 95 | N38: 90 | O38: 85 | P38: 95 | Q38: 90 | R38: 100 | S38: 100 | T38: 90 | U38: 80 | V38: 95 | W38: 80 | X38: 80 | Y38: 61 | Z38: =(G38+J38+M38+P38+S38+T38+V38)*0.02+(E38+H38+K38+N38+Q38+T38+W38)*0.04+(F38+I38+L38+O38+R38+U38+X38)*0.04+Y38*0.32 -> 82.92
A39: 17 | B39: 資科二 | C39: 94703020 | D39: 10 | E39: 90 | F39: 90 | G39: 90 | H39: 90 | I39: 95 | J39: 95 | K39: 100 | L39: 95 | M39: 95 | N39: 90 | O39: 85 | P39: 95 | Q39: 90 | R39: 100 | S39: 100 | T39: 90 | U39: 80 | V39: 95 | W39: 80 | X39: 80 | Y39: 80 | Z39: =(G39+J39+M39+P39+S39+T39+V39)*0.02+(E39+H39+K39+N39+Q39+T39+W39)*0.04+(F39+I39+L39+O39+R39+U39+X39)*0.04+Y39*0.32 -> 89
A40: 24 | B40: 資科二 | C40: 94703028 | D40: 10 | E40: 90 | F40: 90 | G40: 90 | H40: 90 | I40: 95 | J40: 95 | K40: 100 | L40: 95 | M40: 95 | N40: 90 | O40: 85 | P40: 95 | Q40: 90 | R40: 100 | S40: 100 | T40: 90 | U40: 80 | V40: 95 | W40: 80 | X40: 80 | Y40: 51 | Z40: =(G40+J40+M40+P40+S40+T40+V40)*0.02+(E40+H40+K40+N40+Q40+T40+W40)*0.04+(F40+I40+L40+O40+R40+U40+X40)*0.04+Y40*0.32 -> 79.72
A41: 平均 | E41: =AVERAGE(E3:E40) -> 86.84210526315789 | F41: =AVERAGE(F3:F40) -> 85.78947368421052 | G41: =AVERAGE(G3:G40) -> 89.21052631578948 | H41: =AVERAGE(H3:H40) -> 85 | I41: =AVERAGE(I3:I40) -> 93.026315789473685 | J41: =AVERAGE(J3:J40) -> 93.55263157894737 | K41: =AVERAGE(K3:K40) -> 96.84210526315789 | L41: =AVERAGE(L3:L40) -> 84.078947368421055 | M41: =AVERAGE(M3:M40) -> 93.026315789473685 | N41: =AVERAGE(N3:N40) -> 86.84210526315789 | O41: =AVERAGE(O3:O40) -> 84.736842105263165 | P41: =AVERAGE(P3:P40) -> 92.5 | Q41: =AVERAGE(Q3:Q40) -> 69.736842105263165 | R41: =AVERAGE(R3:R40) -> 82.236842105263165 | S41: =AVERAGE(S3:S40) -> 93.55263157894737 | T41: =AVERAGE(T3:T40) -> 86.84210526315789 | U41: =AVERAGE(U3:U40) -> 80.131578947368425 | V41: =AVERAGE(V3:V40) -> 92.5 | W41: =AVERAGE(W3:W40) -> 73.15789473684211 | X41: =AVERAGE(X3:X40) -> 80.39473684210526 | Y41: =AVERAGE(Y3:Y40) -> 61.184210526315788 | Z41: =AVERAGE(Z3:Z40) -> 79.428947368421063