A1: 系級 | B1: 姓名 | C1: 學號 | D1: HW1 | E1: HW2 | F1: HW3 | G1: 期中考 | H1: HW4 | I1: 期末考 | J1: 期末成績
A2: 資科二 | B2: 簡大喬 | C2: 9326 | D2: 99 | E2: 74 | F2: 90 | G2: 84 | H2: 79 | I2: 69 | J2: =E2*0.075+F2*0.075+D2*0.075+H2*0.075+G2*0.35+I2*0.4 -> 82.65
A3: 資科二 | B3: 蔣欣達 | C3: 9308 | D3: 99 | E3: 92 | F3: 90 | G3: 70 | H3: 83 | I3: 51 | J3: =E3*0.075+F3*0.075+D3*0.075+H3*0.075+G3*0.35+I3*0.4 -> 72.2
A4: 資科二 | B4: 陳勇甫 | C4: 9340 | D4: 99 | E4: 92 | F4: 80 | G4: 67 | H4: 89 | I4: 67 | J4: =E4*0.075+F4*0.075+D4*0.075+H4*0.075+G4*0.35+I4*0.4 -> 77.25
A5: 資科二 | B5: 陳韋良 | C5: 9342 | D5: 99 | E5: 90 | F5: 95 | G5: 40 | H5: 87 | I5: 49 | J5: =E5*0.075+F5*0.075+D5*0.075+H5*0.075+G5*0.35+I5*0.4 -> 61.424999999999997
A6: 資科二 | B6: 劉峻豪 | C6: 9303 | D6: 99 | E6: 100 | F6: 90 | G6: 73 | H6: 91 | I6: 51 | J6: =E6*0.075+F6*0.075+D6*0.075+H6*0.075+G6*0.35+I6*0.4 -> 74.45
A7: 資科二 | B7: 林浩蔚 | C7: 9337 | D7: 99 | E7: 99 | F7: 95 | G7: 63 | H7: 94 | I7: 68 | J7: =E7*0.075+F7*0.075+D7*0.075+H7*0.075+G7*0.35+I7*0.4 -> 78.275000000000006
A8: 資科二 | B8: 曾光宏 | C8: 9302 | D8: 99 | E8: 85 | F8: 95 | G8: 45 | H8: 0 | I8: 33 | J8: =E8*0.075+F8*0.075+D8*0.075+H8*0.075+G8*0.35+I8*0.4 -> 49.875
A9: 資科二 | B9: 陳德沛 | C9: 9335 | D9: 99 | E9: 99 | F9: 90 | G9: 87 | H9: 92 | I9: 88 | J9: =E9*0.075+F9*0.075+D9*0.075+H9*0.075+G9*0.35+I9*0.4 -> 94.15
A10: 資科二 | B10: 陳嘉豪 | C10: 9344 | D10: 99 | E10: 82 | F10: 90 | G10: 60 | H10: 92 | I10: 50 | J10: =E10*0.075+F10*0.075+D10*0.075+H10*0.075+G10*0.35+I10*0.4 -> 68.224999999999994
A11: 資科二 | B11: 陳偉華 | C11: 9338 | D11: 99 | E11: 81 | F11: 95 | G11: 71 | H11: 80 | I11: 67 | J11: =E11*0.075+F11*0.075+D11*0.075+H11*0.075+G11*0.35+I11*0.4 -> 78.275000000000006
A12: 資科二 | B12: 顏義倫 | C12: 9321 | D12: 99 | E12: 92 | F12: 100 | G12: 45 | H12: 85 | I12: 54 | J12: =E12*0.075+F12*0.075+D12*0.075+H12*0.075+G12*0.35+I12*0.4 -> 65.55
A13: 資科二 | B13: 詹鎮宇 | C13: 9351 | D13: 99 | E13: 66 | F13: 95 | G13: 49 | H13: 89 | I13: 30 | J13: =E13*0.075+F13*0.075+D13*0.075+H13*0.075+G13*0.35+I13*0.4 -> 55.325000000000003
A14: 資科二 | B14: 李建興 | C14: 9312 | D14: 99 | E14: 84 | F14: 95 | G14: 42 | H14: 87 | I14: 57 | J14: =E14*0.075+F14*0.075+D14*0.075+H14*0.075+G14*0.35+I14*0.4 -> 64.875
A15: 資科二 | B15: 林韋翰 | C15: 9346 | D15: 99 | E15: 99 | F15: 95 | G15: 49 | H15: 87 | I15: 53 | J15: =E15*0.075+F15*0.075+D15*0.075+H15*0.075+G15*0.35+I15*0.4 -> 66.85
A16: 資科二 | B16: 游政螢 | C16: 9347 | D16: 99 | E16: 92 | F16: 90 | G16: 71 | H16: 87 | I16: 67 | J16: =E16*0.075+F16*0.075+D16*0.075+H16*0.075+G16*0.35+I16*0.4 -> 79.25
A17: 資科二 | B17: 蕭名宏 | C17: 9341 | D17: 99 | E17: 100 | F17: 95 | G17: 72 | H17: 98 | I17: 62 | J17: =E17*0.075+F17*0.075+D17*0.075+H17*0.075+G17*0.35+I17*0.4 -> 79.4
A18: 資科二 | B18: 黃于育 | C18: 9309 | D18: 99 | E18: 96 | F18: 95 | G18: 38 | H18: 91 | I18: 68 | J18: =E18*0.075+F18*0.075+D18*0.075+H18*0.075+G18*0.35+I18*0.4 -> 69.075000000000003
A19: 資科二 | B19: 鄭俞佑 | C19: 9315 | D19: 99 | E19: 68 | F19: 80 | G19: 40 | H19: 94 | I19: 78 | J19: =E19*0.075+F19*0.075+D19*0.075+H19*0.075+G19*0.35+I19*0.4 -> 70.775000000000006
A20: 資科二 | B20: 葉慧文 | C20: 9313 | D20: 99 | E20: 100 | F20: 90 | G20: 81 | H20: 100 | I20: 87 | J20: =E20*0.075+F20*0.075+D20*0.075+H20*0.075+G20*0.35+I20*0.4 -> 92.325000000000003
A21: 資科二 | B21: 王方逸 | C21: 9304 | D21: 99 | E21: 91 | F21: 95 | G21: 83 | H21: 94 | I21: 90 | J21: =E21*0.075+F21*0.075+D21*0.075+H21*0.075+G21*0.35+I21*0.4 -> 93.474999999999994
A22: 資科二 | B22: 黃婉汝 | C22: 9310 | D22: 99 | E22: 96 | F22: 85 | G22: 42 | H22: 97 | I22: 59 | J22: =E22*0.075+F22*0.075+D22*0.075+H22*0.075+G22*0.35+I22*0.4 -> 66.575000000000003
A23: 資科二 | B23: 許藍尹 | C23: 9314 | D23: 99 | E23: 86 | F23: 85 | G23: 75 | H23: 95 | I23: 67 | J23: =E23*0.075+F23*0.075+D23*0.075+H23*0.075+G23*0.35+I23*0.4 -> 80.424999999999997
A24: 資科二 | B24: 張允泰 | C24: 9343 | D24: 99 | E24: 96 | F24: 100 | G24: 70 | H24: 100 | I24: 72 | J24: =E24*0.075+F24*0.075+D24*0.075+H24*0.075+G24*0.35+I24*0.4 -> 82.924999999999997
A25: 資科二 | B25: 劉佳欣 | C25: 9317 | D25: 99 | E25: 100 | F25: 95 | G25: 86 | H25: 95 | I25: 76 | J25: =E25*0.075+F25*0.075+D25*0.075+H25*0.075+G25*0.35+I25*0.4 -> 89.674999999999997
A26: 資科二 | B26: 陳映似 | C26: 9319 | D26: 99 | E26: 96 | F26: 95 | G26: 79 | H26: 85 | I26: 68 | J26: =E26*0.075+F26*0.075+D26*0.075+H26*0.075+G26*0.35+I26*0.4 -> 82.974999999999994
A27: 資科二 | B27: 吳菀儒 | C27: 9325 | D27: 99 | E27: 87 | F27: 55 | G27: 37 | H27: 83 | I27: 41 | J27: =E27*0.075+F27*0.075+D27*0.075+H27*0.075+G27*0.35+I27*0.4 -> 53.65
A28: 資科二 | B28: 林欣芸 | C28: 9332 | D28: 87 | E28: 88 | F28: 85 | G28: 32 | H28: 86 | I28: 70 | J28: =E28*0.075+F28*0.075+D28*0.075+H28*0.075+G28*0.35+I28*0.4 -> 65.15
A29: 資科二 | B29: 江建興 | C29: 9327 | D29: 99 | E29: 80 | F29: 85 | G29: 57 | H29: 94 | I29: 46 | J29: =E29*0.075+F29*0.075+D29*0.075+H29*0.075+G29*0.35+I29*0.4 -> 65.2
A30: 資科二 | B30: 郭呈宇 | C30: 9322 | D30: 99 | E30: 91 | F30: 85 | G30: 52 | H30: 94 | I30: 48 | J30: =E30*0.075+F30*0.075+D30*0.075+H30*0.075+G30*0.35+I30*0.4 -> 65.075000000000003
A31: 資科二 | B31: 劉彥廷 | C31: 9323 | D31: 99 | E31: 79 | F31: 80 | G31: 41 | H31: 82 | I31: 50 | J31: 60
A32: 資科二 | B32: 汪政憲 | C32: 9333 | D32: 99 | E32: 92 | F32: 90 | G32: 50 | H32: 94 | I32: 75 | J32: =E32*0.075+F32*0.075+D32*0.075+H32*0.075+G32*0.35+I32*0.4 -> 75.625
A33: 資科二 | B33: 黃家忠 | C33: 9306 | D33: 99 | E33: 80 | F33: 70 | G33: 28 | H33: 87 | I33: 55 | J33: 60
A34: 資科二 | B34: 余冠青 | C34: 9329 | D34: 99 | E34: 70 | F34: 80 | G34: 24 | H34: 86 | I34: 26 | J34: =E34*0.075+F34*0.075+D34*0.075+H34*0.075+G34*0.35+I34*0.4 -> 43.924999999999997
A35: 資科二 | B35: 彭浩軒 | C35: 9331 | D35: 87 | E35: 91 | F35: 55 | G35: 62 | H35: 86 | I35: 60 | J35: =E35*0.075+F35*0.075+D35*0.075+H35*0.075+G35*0.35+I35*0.4 -> 69.625
A36: 資科二 | B36: 莊蕙郡 | C36: 9305 | D36: 99 | E36: 84 | F36: 80 | G36: 21 | H36: 85 | I36: 53 | J36: =E36*0.075+F36*0.075+D36*0.075+H36*0.075+G36*0.35+I36*0.4 -> 54.65
A37: 資科二 | B37: 羅苡瑄 | C37: 9339 | D37: 99 | E37: 84 | F37: 95 | G37: 42 | H37: 90 | I37: 74 | J37: =E37*0.075+F37*0.075+D37*0.075+H37*0.075+G37*0.35+I37*0.4 -> 71.9
A38: 資科二 | B38: 郭盈希 | C38: 9336 | D38: 99 | E38: 96 | F38: 95 | G38: 69 | H38: 91 | I38: 85 | J38: =E38*0.075+F38*0.075+D38*0.075+H38*0.075+G38*0.35+I38*0.4 -> 86.724999999999994
A39: 資科二 | B39: 張馨之 | C39: 9334 | D39: 99 | E39: 89 | F39: 95 | G39: 80 | H39: 94 | I39: 88 | J39: =E39*0.075+F39*0.075+D39*0.075+H39*0.075+G39*0.35+I39*0.4 -> 91.474999999999994
A40: 資科二 | B40: 周世剛 | C40: 9316 | D40: 99 | E40: 95 | F40: 90 | G40: 49 | H40: 90 | I40: 68 | J40: =E40*0.075+F40*0.075+D40*0.075+H40*0.075+G40*0.35+I40*0.4 -> 72.4
A41: 資科二 | B41: 吳晨帆 | C41: 9311 | D41: 99 | E41: 94 | F41: 95 | G41: 64 | H41: 94 | I41: 70 | J41: =E41*0.075+F41*0.075+D41*0.075+H41*0.075+G41*0.35+I41*0.4 -> 79.05
A42: 資科二 | B42: 林祐加 | C42: 9328 | D42: 99 | E42: 80 | F42: 90 | G42: 32 | H42: 80 | I42: 48 | J42: 60
A43: 資科二 | B43: 吳鈞銘 | C43: 9318 | D43: 99 | E43: 58 | F43: 80 | G43: 44 | H43: 84 | I43: 67 | J43: =E43*0.075+F43*0.075+D43*0.075+H43*0.075+G43*0.35+I43*0.4 -> 66.275000000000006
A44: 應數四 | B44: 鄭聖耀 | C44: 91701008 | D44: 99 | E44: 92 | F44: 70 | G44: 83 | H44: 80 | I44: 67 | J44: =E44*0.075+F44*0.075+D44*0.075+H44*0.075+G44*0.35+I44*0.4 -> 81.424999999999997
A45: 資管二 | B45: 詹承偉 | C45: 92306018 | D45: 99 | E45: 87 | F45: 30 | G45: 66 | H45: 88 | I45: 74 | J45: =E45*0.075+F45*0.075+D45*0.075+H45*0.075+G45*0.35+I45*0.4 -> 75.5
A46: 資管三 | B46: 顏志晟 | C46: 92306026 | D46: 99 | E46: 92 | F46: 95 | G46: 79 | H46: 83 | I46: 98 | J46: =E46*0.075+F46*0.075+D46*0.075+H46*0.075+G46*0.35+I46*0.4 -> 94.525000000000006
A47: 資管一 | B47: 高國書 | C47: 94306014 | D47: 81 | E47: 74 | F47: 60 | G47: 29 | H47: 81 | I47: 35 | J47: =E47*0.075+F47*0.075+D47*0.075+H47*0.075+G47*0.35+I47*0.4 -> 46.35
A48: 地政四 | B48: 李宏君 | C48: 91207426 | D48: 99 | E48: 93 | F48: 90 | G48: 44 | H48: 79 | I48: 62 | J48: =E48*0.075+F48*0.075+D48*0.075+H48*0.075+G48*0.35+I48*0.4 -> 67.275000000000006
A49: 地政四 | B49: 邱煥智 | C49: 91207438 | D49: 99 | E49: 96 | F49: 90 | G49: 58 | H49: 85 | I49: 43 | J49: =E49*0.075+F49*0.075+D49*0.075+H49*0.075+G49*0.35+I49*0.4 -> 65.25
A50: 地政四 | B50: 黃炳瑜 | C50: 91207440 | D50: 99 | E50: 91 | F50: 100 | G50: 45 | H50: 81 | I50: 56 | J50: =E50*0.075+F50*0.075+D50*0.075+H50*0.075+G50*0.35+I50*0.4 -> 65.974999999999994
A51: 資科二 | B51: 官千羽 | C51: 9330 | D51: 87 | E51: 89 | F51: 95 | G51: 48 | H51: 90 | I51: 28 | J51: =E51*0.075+F51*0.075+D51*0.075+H51*0.075+G51*0.35+I51*0.4 -> 55.075000000000003