A3: 學號 | B3: 期中考(原始) | C3: 加分後
A4: 91207426 | B4: 44 | C4: =B4+6 -> 50
A5: 91207438 | B5: 58 | C5: =B5+6 -> 64
A6: 91207440 | B6: 45 | C6: =B6+6 -> 51
A7: 94306014 | B7: 29 | C7: =B7+6 -> 35
A8: 92306018 | B8: 66 | C8: =B8+6 -> 72
A9: 92306026 | B9: 79 | C9: =B9+6 -> 85
A10: 91701008 | B10: 83 | C10: =B10+6 -> 89
A11: 9302 | B11: 45 | C11: =B11+6 -> 51
A12: 9303 | B12: 73 | C12: =B12+6 -> 79
A13: 9304 | B13: 83 | C13: =B13+6 -> 89
A14: 9305 | B14: 21 | C14: =B14+6 -> 27
A15: 9306 | B15: 28 | C15: =B15+6 -> 34
A16: 9308 | B16: 70 | C16: =B16+6 -> 76
A17: 9309 | B17: 38 | C17: =B17+6 -> 44
A18: 9310 | B18: 42 | C18: =B18+6 -> 48
A19: 9311 | B19: 64 | C19: =B19+6 -> 70
A20: 9312 | B20: 42 | C20: =B20+6 -> 48
A21: 9313 | B21: 81 | C21: =B21+6 -> 87
A22: 9314 | B22: 75 | C22: =B22+6 -> 81
A23: 9315 | B23: 40 | C23: =B23+6 -> 46
A24: 9316 | B24: 49 | C24: =B24+6 -> 55
A25: 9317 | B25: 86 | C25: =B25+6 -> 92
A26: 9318 | B26: 44 | C26: =B26+6 -> 50
A27: 9319 | B27: 79 | C27: =B27+6 -> 85
A28: 9321 | B28: 45 | C28: =B28+6 -> 51
A29: 9322 | B29: 52 | C29: =B29+6 -> 58
A30: 9323 | B30: 41 | C30: =B30+6 -> 47
A31: 9325 | B31: 37 | C31: =B31+6 -> 43
A32: 9326 | B32: 84 | C32: =B32+6 -> 90
A33: 9327 | B33: 57 | C33: =B33+6 -> 63
A34: 9328 | B34: 32 | C34: =B34+6 -> 38
A35: 9329 | B35: 24 | C35: =B35+6 -> 30
A36: 9330 | B36: 48 | C36: =B36+6 -> 54
A37: 9331 | B37: 62 | C37: =B37+6 -> 68
A38: 9332 | B38: 32 | C38: =B38+6 -> 38
A39: 9333 | B39: 50 | C39: =B39+6 -> 56
A40: 9334 | B40: 80 | C40: =B40+6 -> 86
A41: 9335 | B41: 87 | C41: =B41+6 -> 93
A42: 9336 | B42: 69 | C42: =B42+6 -> 75
A43: 9337 | B43: 63 | C43: =B43+6 -> 69
A44: 9338 | B44: 71 | C44: =B44+6 -> 77
A45: 9339 | B45: 42 | C45: =B45+6 -> 48
A46: 9340 | B46: 67 | C46: =B46+6 -> 73
A47: 9341 | B47: 72 | C47: =B47+6 -> 78
A48: 9342 | B48: 40 | C48: =B48+6 -> 46
A49: 9343 | B49: 70 | C49: =B49+6 -> 76
A50: 9344 | B50: 60 | C50: =B50+6 -> 66
A51: 9346 | B51: 49 | C51: =B51+6 -> 55
A52: 9347 | B52: 71 | C52: =B52+6 -> 77
A53: 9351 | B53: 49 | C53: =B53+6 -> 55
A54: Average | C54: =AVERAGE(C4:C53) -> 62.36