A1: Digital Systems 2005 Final Grade
A3: 學號 | B3: hw0 | C3: hw1 | D3: hw2 | E3: hw3 | F3: 期中考 | G3: 期末考 | H3: 總成績
A4: 91104012 | B4: 0 | C4: 100 | D4: 79 | E4: 67 | F4: 71 | G4: 27 | H4: 60
A5: 91303003 | B5: 100 | C5: 100 | D5: 95 | E5: 95 | F5: 73 | G5: 78 | H5: =F5*0.4+G5*0.4+B5*0.05+C5*0.07+D5*0.07+E5*0.06 -> 84.75
A6: 90306086 | B6: 100 | C6: 100 | D6: 100 | E6: 97 | F6: 75 | G6: 84 | H6: =F6*0.4+G6*0.4+B6*0.05+C6*0.07+D6*0.07+E6*0.06 -> 88.42
A7: 91701036 | B7: 100 | C7: 100 | D7: 0 | E7: 0 | F7: 39 | G7: 0 | H7: =F7*0.4+G7*0.4+B7*0.05+C7*0.07+D7*0.07+E7*0.06 -> 27.6
A8: 90207438 | B8: 100 | C8: 100 | D8: 84 | E8: 0 | F8: 79 | G8: 51 | H8: =F8*0.4+G8*0.4+B8*0.05+C8*0.07+D8*0.07+E8*0.06 -> 69.88
A9: 91703026 | B9: 100 | C9: 100 | D9: 93 | E9: 90 | F9: 81 | G9: 76 | H9: =F9*0.4+G9*0.4+B9*0.05+C9*0.07+D9*0.07+E9*0.06 -> 86.71
A10: 92703001 | B10: 100 | C10: 100 | D10: 88 | E10: 95 | F10: 75 | G10: 56 | H10: =F10*0.4+G10*0.4+B10*0.05+C10*0.07+D10*0.07+E10*0.06 -> 76.26
A11: 92703003 | B11: 100 | C11: 100 | D11: 78 | E11: 93 | F11: 74 | G11: 55 | H11: =F11*0.4+G11*0.4+B11*0.05+C11*0.07+D11*0.07+E11*0.06 -> 74.64
A12: 92703004 | B12: 100 | C12: 100 | D12: 100 | E12: 95 | F12: 78 | G12: 71 | H12: =F12*0.4+G12*0.4+B12*0.05+C12*0.07+D12*0.07+E12*0.06 -> 84.3
A13: 92703005 | B13: 100 | C13: 100 | D13: 80 | E13: 95 | F13: 38 | G13: 5 | H13: =F13*0.4+G13*0.4+B13*0.05+C13*0.07+D13*0.07+E13*0.06 -> 40.5
A14: 92703006 | B14: 100 | C14: 100 | D14: 94 | E14: 95 | F14: 67 | G14: 57 | H14: =F14*0.4+G14*0.4+B14*0.05+C14*0.07+D14*0.07+E14*0.06 -> 73.88
A15: 92703007 | B15: 100 | C15: 90 | D15: 99 | E15: 92 | F15: 72 | G15: 51 | H15: =F15*0.4+G15*0.4+B15*0.05+C15*0.07+D15*0.07+E15*0.06 -> 72.95
A16: 92703008 | B16: 100 | C16: 100 | D16: 98 | E16: 95 | F16: 60 | G16: 65 | H16: =F16*0.4+G16*0.4+B16*0.05+C16*0.07+D16*0.07+E16*0.06 -> 74.56
A17: 92703009 | B17: 100 | C17: 100 | D17: 98 | E17: 97 | F17: 57 | G17: 71 | H17: =F17*0.4+G17*0.4+B17*0.05+C17*0.07+D17*0.07+E17*0.06 -> 75.88
A18: 92703010 | B18: 100 | C18: 100 | D18: 94 | E18: 90 | F18: 62 | G18: 67 | H18: =F18*0.4+G18*0.4+B18*0.05+C18*0.07+D18*0.07+E18*0.06 -> 75.58
A19: 92703011 | B19: 100 | C19: 100 | D19: 98 | E19: 92 | F19: 70 | G19: 65 | H19: =F19*0.4+G19*0.4+B19*0.05+C19*0.07+D19*0.07+E19*0.06 -> 78.38
A20: 92703012 | B20: 100 | C20: 100 | D20: 84 | E20: 85 | F20: 67 | G20: 76 | H20: =F20*0.4+G20*0.4+B20*0.05+C20*0.07+D20*0.07+E20*0.06 -> 80.18
A21: 92703013 | B21: 100 | C21: 100 | D21: 84 | E21: 90 | F21: 62 | G21: 61 | H21: =F21*0.4+G21*0.4+B21*0.05+C21*0.07+D21*0.07+E21*0.06 -> 72.48
A22: 92703014 | B22: 100 | C22: 85 | D22: 84 | E22: 75 | F22: 50 | G22: 58 | H22: =F22*0.4+G22*0.4+B22*0.05+C22*0.07+D22*0.07+E22*0.06 -> 64.53
A23: 92703015 | B23: 100 | C23: 100 | D23: 86 | E23: 100 | F23: 52 | G23: 56 | H23: =F23*0.4+G23*0.4+B23*0.05+C23*0.07+D23*0.07+E23*0.06 -> 67.22
A24: 92703016 | B24: 100 | C24: 100 | D24: 84 | E24: 92 | F24: 57 | G24: 62 | H24: =F24*0.4+G24*0.4+B24*0.05+C24*0.07+D24*0.07+E24*0.06 -> 71
A25: 92703017 | B25: 100 | C25: 100 | D25: 89 | E25: 97 | F25: 81 | G25: 79 | H25: =F25*0.4+G25*0.4+B25*0.05+C25*0.07+D25*0.07+E25*0.06 -> 88.05
A26: 92703018 | B26: 100 | C26: 100 | D26: 88 | E26: 75 | F26: 47 | G26: 71 | H26: =F26*0.4+G26*0.4+B26*0.05+C26*0.07+D26*0.07+E26*0.06 -> 69.86
A27: 92703019 | B27: 100 | C27: 100 | D27: 88 | E27: 95 | F27: 60 | G27: 68 | H27: =F27*0.4+G27*0.4+B27*0.05+C27*0.07+D27*0.07+E27*0.06 -> 75.06
A28: 92703020 | B28: 100 | C28: 100 | D28: 94 | E28: 95 | F28: 63 | G28: 72 | H28: =F28*0.4+G28*0.4+B28*0.05+C28*0.07+D28*0.07+E28*0.06 -> 78.28
A29: 92703021 | B29: 100 | C29: 100 | D29: 95 | E29: 100 | F29: 86 | G29: 70 | H29: =F29*0.4+G29*0.4+B29*0.05+C29*0.07+D29*0.07+E29*0.06 -> 87.05
A30: 92703022 | B30: 100 | C30: 100 | D30: 100 | E30: 100 | F30: 83 | G30: 77 | H30: =F30*0.4+G30*0.4+B30*0.05+C30*0.07+D30*0.07+E30*0.06 -> 89
A31: 92703023 | B31: 100 | C31: 100 | D31: 84 | E31: 82 | F31: 71 | G31: 62 | H31: =F31*0.4+G31*0.4+B31*0.05+C31*0.07+D31*0.07+E31*0.06 -> 76
A32: 92703024 | B32: 100 | C32: 100 | D32: 95 | E32: 100 | F32: 78 | G32: 84 | H32: =F32*0.4+G32*0.4+B32*0.05+C32*0.07+D32*0.07+E32*0.06 -> 89.45
A33: 92703025 | B33: 100 | C33: 100 | D33: 97 | E33: 95 | F33: 38 | G33: 72 | H33: =F33*0.4+G33*0.4+B33*0.05+C33*0.07+D33*0.07+E33*0.06 -> 68.49
A34: 92703026 | B34: 100 | C34: 100 | D34: 87 | E34: 92 | F34: 48 | G34: 71 | H34: =F34*0.4+G34*0.4+B34*0.05+C34*0.07+D34*0.07+E34*0.06 -> 71.21
A35: 92703027 | B35: 100 | C35: 100 | D35: 0 | E35: 0 | F35: 42 | G35: 0 | H35: =F35*0.4+G35*0.4+B35*0.05+C35*0.07+D35*0.07+E35*0.06 -> 28.8
A36: 92703028 | B36: 100 | C36: 100 | D36: 81 | E36: 93 | F36: 67 | G36: 83 | H36: =F36*0.4+G36*0.4+B36*0.05+C36*0.07+D36*0.07+E36*0.06 -> 83.25
A37: 92703029 | B37: 100 | C37: 100 | D37: 100 | E37: 95 | F37: 73 | G37: 82 | H37: =F37*0.4+G37*0.4+B37*0.05+C37*0.07+D37*0.07+E37*0.06 -> 86.7
A38: 92703030 | B38: 100 | C38: 100 | D38: 90 | E38: 77 | F38: 64 | G38: 55 | H38: =F38*0.4+G38*0.4+B38*0.05+C38*0.07+D38*0.07+E38*0.06 -> 70.52
A39: 92703032 | B39: 100 | C39: 100 | D39: 88 | E39: 90 | F39: 73 | G39: 75 | H39: =F39*0.4+G39*0.4+B39*0.05+C39*0.07+D39*0.07+E39*0.06 -> 82.76
A40: 92703033 | B40: 100 | C40: 100 | D40: 94 | E40: 100 | F40: 57 | G40: 62 | H40: =F40*0.4+G40*0.4+B40*0.05+C40*0.07+D40*0.07+E40*0.06 -> 72.18
A41: 92703034 | B41: 100 | C41: 100 | D41: 100 | E41: 100 | F41: 70 | G41: 92 | H41: =F41*0.4+G41*0.4+B41*0.05+C41*0.07+D41*0.07+E41*0.06 -> 89.8
A42: 92703035 | B42: 100 | C42: 100 | D42: 77 | E42: 92 | F42: 75 | G42: 87 | H42: =F42*0.4+G42*0.4+B42*0.05+C42*0.07+D42*0.07+E42*0.06 -> 87.71
A43: 92703036 | B43: 100 | C43: 100 | D43: 100 | E43: 80 | F43: 61 | G43: 58 | H43: =F43*0.4+G43*0.4+B43*0.05+C43*0.07+D43*0.07+E43*0.06 -> 71.4
A44: 92703037 | B44: 100 | C44: 100 | D44: 97 | E44: 90 | F44: 76 | G44: 86 | H44: =F44*0.4+G44*0.4+B44*0.05+C44*0.07+D44*0.07+E44*0.06 -> 88.99
A45: 92703038 | B45: 100 | C45: 100 | D45: 76 | E45: 92 | F45: 65 | G45: 61 | H45: =F45*0.4+G45*0.4+B45*0.05+C45*0.07+D45*0.07+E45*0.06 -> 73.24
A46: 92703039 | B46: 100 | C46: 100 | D46: 82 | E46: 95 | F46: 74 | G46: 75 | H46: =F46*0.4+G46*0.4+B46*0.05+C46*0.07+D46*0.07+E46*0.06 -> 83.04
A47: 92703040 | B47: 100 | C47: 100 | D47: 94 | E47: 95 | F47: 65 | G47: 58 | H47: =F47*0.4+G47*0.4+B47*0.05+C47*0.07+D47*0.07+E47*0.06 -> 73.48
A48: 92703041 | B48: 100 | C48: 100 | D48: 100 | E48: 95 | F48: 69 | G48: 74 | H48: =F48*0.4+G48*0.4+B48*0.05+C48*0.07+D48*0.07+E48*0.06 -> 81.9
A49: 92703042 | B49: 100 | C49: 100 | D49: 100 | E49: 90 | F49: 62 | G49: 76 | H49: =F49*0.4+G49*0.4+B49*0.05+C49*0.07+D49*0.07+E49*0.06 -> 79.6
A50: 92703043 | B50: 100 | C50: 100 | D50: 84 | E50: 90 | F50: 68 | G50: 46 | H50: =F50*0.4+G50*0.4+B50*0.05+C50*0.07+D50*0.07+E50*0.06 -> 68.88
A51: 92703044 | B51: 100 | C51: 100 | D51: 72 | E51: 95 | F51: 64 | G51: 60 | H51: =F51*0.4+G51*0.4+B51*0.05+C51*0.07+D51*0.07+E51*0.06 -> 72.34
A52: 92703045 | B52: 100 | C52: 100 | D52: 99 | E52: 95 | F52: 37 | G52: 35 | H52: 60
A53: 92703047 | B53: 100 | C53: 100 | D53: 86 | E53: 100 | F53: 55 | G53: 40 | H53: =F53*0.4+G53*0.4+B53*0.05+C53*0.07+D53*0.07+E53*0.06 -> 62.02
A54: 92703048 | B54: 100 | C54: 100 | D54: 77 | E54: 88 | F54: 60 | G54: 44 | H54: =F54*0.4+G54*0.4+B54*0.05+C54*0.07+D54*0.07+E54*0.06 -> 64.27
A55: 92703049 | B55: 100 | C55: 100 | D55: 88 | E55: 100 | F55: 70 | G55: 71 | H55: =F55*0.4+G55*0.4+B55*0.05+C55*0.07+D55*0.07+E55*0.06 -> 80.56
A56: 92703051 | B56: 0 | C56: 100 | D56: 93 | E56: 95 | F56: 57 | G56: 76 | H56: =F56*0.4+G56*0.4+B56*0.05+C56*0.07+D56*0.07+E56*0.06 -> 72.41
A57: 91703030 | B57: 0 | C57: 95 | D57: 0 | E57: 95 | F57: 57 | G57: 46 | H57: 60
A58: 91703048 | B58: 100 | C58: 100 | D58: 100 | E58: 100 | F58: 73 | G58: 63 | H58: =F58*0.4+G58*0.4+B58*0.05+C58*0.07+D58*0.07+E58*0.06 -> 79.4
A59: 92753031 | B59: 100 | C59: 100 | D59: 100 | E59: 100 | F59: 77 | G59: 85 | H59: =F59*0.4+G59*0.4+B59*0.05+C59*0.07+D59*0.07+E59*0.06 -> 89.8