A1: 姓名 | B1: HW1/50 | C1: HW2/100 | D1: HW3 / 50 | E1: 期中考 | F1: 期末考 | G1: 學期成績
A2: 吳宗謙 | B2: 50 | C2: 82 | D2: 37 | E2: 91 | F2: 75 | G2: =B2*0.2+C2*0.1+D2*0.2+E2*0.3+F2*0.4 -> 82.9
A3: 鄭兆翔 | B3: 50 | C3: 64 | D3: 11 | E3: 77 | F3: 56 | G3: =B3*0.2+C3*0.1+D3*0.2+E3*0.3+F3*0.4 -> 64.1
A4: 胡瑋霖 | B4: 49 | C4: 100 | D4: 44 | E4: 91 | F4: 70 | G4: =B4*0.2+C4*0.1+D4*0.2+E4*0.3+F4*0.4 -> 83.9
A5: 張世元 | B5: 50 | C5: 94 | D5: 37 | E5: 90 | F5: 55 | G5: =B5*0.2+C5*0.1+D5*0.2+E5*0.3+F5*0.4 -> 75.8
A6: 傅光暐 | B6: 49 | C6: 100 | D6: 42 | E6: 88 | F6: 85 | G6: =B6*0.2+C6*0.1+D6*0.2+E6*0.3+F6*0.4 -> 88.6
A7: 陳冠穎 | B7: 50 | C7: 70 | D7: 32 | E7: 36 | F7: 51 | G7: =B7*0.2+C7*0.1+D7*0.2+E7*0.3+F7*0.4 -> 54.6
A8: 卓立皓 | B8: 50 | C8: 92 | D8: 39 | E8: 75 | F8: 42 | G8: =B8*0.2+C8*0.1+D8*0.2+E8*0.3+F8*0.4 -> 66.3
A9: 朱仁杰 | B9: 49 | C9: 90 | D9: 50 | E9: 76 | F9: 65 | G9: =B9*0.2+C9*0.1+D9*0.2+E9*0.3+F9*0.4 -> 77.6
A10: 許孜銚 | B10: 50 | C10: 90 | D10: 45 | E10: 52 | F10: 49 | G10: =B10*0.2+C10*0.1+D10*0.2+E10*0.3+F10*0.4 -> 63.2
A11: 林開印 | B11: 50 | C11: 88 | D11: 50 | E11: 85 | F11: 64 | G11: =B11*0.2+C11*0.1+D11*0.2+E11*0.3+F11*0.4 -> 79.9
A12: 許嘉容 | B12: 49 | C12: 96 | D12: 0 | E12: 59 | F12: 64 | G12: =B12*0.2+C12*0.1+D12*0.2+E12*0.3+F12*0.4 -> 62.7
A13: 林宗銘 | B13: 49 | C13: 70 | D13: 43 | E13: 90 | F13: 75 | G13: =B13*0.2+C13*0.1+D13*0.2+E13*0.3+F13*0.4 -> 82.4
A14: 王加元 | B14: 40 | C14: 90 | D14: 43 | E14: 78 | F14: 59 | G14: =B14*0.2+C14*0.1+D14*0.2+E14*0.3+F14*0.4 -> 72.6
A15: 吳仕斌 | B15: 40 | C15: 77 | D15: 45 | E15: 68 | F15: 30 | G15: 60
A16: 黃源鱗 | B16: 40 | C16: 58 | D16: 27 | E16: 70 | F16: 71 | G16: =B16*0.2+C16*0.1+D16*0.2+E16*0.3+F16*0.4 -> 68.6
A17: 黃偉嘉 | B17: 40 | C17: 73 | D17: 0 | E17: 52 | F17: 61 | G17: =B17*0.2+C17*0.1+D17*0.2+E17*0.3+F17*0.4 -> 55.3
A18: 張永青 | B18: 40 | C18: 80 | D18: 45 | E18: 66 | F18: 62 | G18: =B18*0.2+C18*0.1+D18*0.2+E18*0.3+F18*0.4 -> 69.6
A19: 王子成 | B19: 49 | C19: 90 | D19: 50 | E19: 44 | F19: 41 | G19: 60
A20: 林文隆 | B20: 40 | C20: 78 | D20: 48 | E20: 55 | F20: 62 | G20: =B20*0.2+C20*0.1+D20*0.2+E20*0.3+F20*0.4 -> 66.7
A21: 黃俊哲 | B21: 40 | C21: 98 | D21: 42 | E21: 42 | F21: 42 | G21: =B21*0.2+C21*0.1+D21*0.2+E21*0.3+F21*0.4 -> 55.6
A22: 陳思叡 | B22: 50 | C22: 100 | D22: 41 | E22: 62 | F22: 39 | G22: =B22*0.2+C22*0.1+D22*0.2+E22*0.3+F22*0.4 -> 62.4
A23: 黃麒愷 | B23: 40 | C23: 82 | D23: 45 | E23: 62 | F23: 60 | G23: =B23*0.2+C23*0.1+D23*0.2+E23*0.3+F23*0.4 -> 67.8
A24: 曾榮國 | B24: 48 | C24: 96 | D24: 33 | E24: 78 | F24: 50 | G24: =B24*0.2+C24*0.1+D24*0.2+E24*0.3+F24*0.4 -> 69.2
A25: 丘祐瑋 | B25: 50 | C25: 92 | D25: 45 | E25: 88 | F25: 44 | G25: =B25*0.2+C25*0.1+D25*0.2+E25*0.3+F25*0.4 -> 72.2
A26: 劉致瑋 | B26: 50 | C26: 82 | D26: 45 | E26: 59 | F26: 39 | G26: =B26*0.2+C26*0.1+D26*0.2+E26*0.3+F26*0.4 -> 60.5
A27: 吳育奇 | B27: 40 | C27: 74 | D27: 42 | E27: 52 | F27: 62 | G27: =B27*0.2+C27*0.1+D27*0.2+E27*0.3+F27*0.4 -> 64.2
A28: 黃奕欽 | B28: 40 | C28: 74 | D28: 45 | E28: 56 | F28: 44 | G28: 60
A29: 吳宗儒 | B29: 48 | C29: 94 | D29: 45 | E29: 72 | F29: 41 | G29: =B29*0.2+C29*0.1+D29*0.2+E29*0.3+F29*0.4 -> 66
A30: 江致廣 | B30: 40 | C30: 0 | D30: 0 | E30: 22 | F30: 0 | G30: =B30*0.2+C30*0.1+D30*0.2+E30*0.3+F30*0.4 -> 14.6
A31: 張時瑋 | B31: 40 | C31: 92 | D31: 46 | E31: 53 | F31: 59 | G31: =B31*0.2+C31*0.1+D31*0.2+E31*0.3+F31*0.4 -> 65.9
A32: 蔡言申 | B32: 49 | C32: 100 | D32: 42 | E32: 76 | F32: 45 | G32: =B32*0.2+C32*0.1+D32*0.2+E32*0.3+F32*0.4 -> 69
A33: 王昱鈞 | B33: 50 | C33: 100 | D33: 45 | E33: 102 | F33: 80 | G33: =B33*0.2+C33*0.1+D33*0.2+E33*0.3+F33*0.4 -> 91.6
A34: 王柏舜 | B34: 49 | C34: 90 | D34: 45 | E34: 75 | F34: 44 | G34: =B34*0.2+C34*0.1+D34*0.2+E34*0.3+F34*0.4 -> 67.9
A35: 陳伯煇 | B35: 40 | C35: 86 | D35: 42 | E35: 86 | F35: 67 | G35: =B35*0.2+C35*0.1+D35*0.2+E35*0.3+F35*0.4 -> 77.6
A36: 趙建富 | B36: 44 | C36: 97 | D36: 44 | E36: 76 | F36: 66 | G36: =B36*0.2+C36*0.1+D36*0.2+E36*0.3+F36*0.4 -> 76.5
A37: 陳家郁 | B37: 50 | C37: 100 | D37: 50 | E37: 93 | F37: 61 | G37: =B37*0.2+C37*0.1+D37*0.2+E37*0.3+F37*0.4 -> 82.3
A38: 唐世欣 | B38: 50 | C38: 69 | D38: 28 | E38: 87 | F38: 67 | G38: =B38*0.2+C38*0.1+D38*0.2+E38*0.3+F38*0.4 -> 75.4
A39: 楊禮瑋 | B39: 40 | C39: 85 | D39: 34 | E39: 55 | F39: 65 | G39: =B39*0.2+C39*0.1+D39*0.2+E39*0.3+F39*0.4 -> 65.8
A40: 胡耕霖 | B40: 49 | C40: 94 | D40: 45 | E40: 90 | F40: 76 | G40: =B40*0.2+C40*0.1+D40*0.2+E40*0.3+F40*0.4 -> 85.6
A41: 詹亞騰 | B41: 50 | C41: 92 | D41: 48 | E41: 96 | F41: 70 | G41: =B41*0.2+C41*0.1+D41*0.2+E41*0.3+F41*0.4 -> 85.6
A42: 許祐銘 | B42: 50 | C42: 100 | D42: 50 | E42: 90 | F42: 78 | G42: =B42*0.2+C42*0.1+D42*0.2+E42*0.3+F42*0.4 -> 88.2
A43: 郭韋志 | B43: 48 | C43: 94 | D43: 42 | E43: 75 | F43: 22 | G43: 60
A44: 雷嘉駿 | B44: 50 | C44: 100 | D44: 50 | E44: 82 | F44: 70 | G44: =B44*0.2+C44*0.1+D44*0.2+E44*0.3+F44*0.4 -> 82.6
A45: 劉克鑛 | B45: 49 | C45: 98 | D45: 48 | E45: 87 | F45: 61 | G45: =B45*0.2+C45*0.1+D45*0.2+E45*0.3+F45*0.4 -> 79.7
A46: 賴衍方 | B46: 40 | C46: 94 | D46: 41 | E46: 41 | F46: 26 | G46: =B46*0.2+C46*0.1+D46*0.2+E46*0.3+F46*0.4 -> 48.3
A47: 彭蓮婷 | B47: 49 | C47: 88 | D47: 47 | E47: 70 | F47: 42 | G47: =B47*0.2+C47*0.1+D47*0.2+E47*0.3+F47*0.4 -> 65.8
A48: 林佳瑩 | B48: 40 | C48: 76 | D48: 40 | E48: 84 | F48: 69 | G48: =B48*0.2+C48*0.1+D48*0.2+E48*0.3+F48*0.4 -> 76.4
A49: 謝棋安 | B49: 48 | C49: 94 | D49: 46 | E49: 91 | F49: 69 | G49: =B49*0.2+C49*0.1+D49*0.2+E49*0.3+F49*0.4 -> 83.1
A50: 吳曜撰 | B50: 45 | C50: 100 | D50: 50 | E50: 79 | F50: 72 | G50: =B50*0.2+C50*0.1+D50*0.2+E50*0.3+F50*0.4 -> 81.5
A51: 林藝軒 | B51: 40 | C51: 84 | D51: 50 | E51: 101 | F51: 52 | G51: =B51*0.2+C51*0.1+D51*0.2+E51*0.3+F51*0.4 -> 77.5
A52: 黎柏琦 | B52: 40 | C52: 100 | D52: 40 | E52: 87 | F52: 36 | G52: =B52*0.2+C52*0.1+D52*0.2+E52*0.3+F52*0.4 -> 66.5
A53: 黃凱懋 | B53: 49 | C53: 100 | D53: 41 | E53: 71 | F53: 51 | G53: =B53*0.2+C53*0.1+D53*0.2+E53*0.3+F53*0.4 -> 69.7
A54: 邱致豪 | B54: 0 | C54: 0 | D54: 0 | E54: 0 | F54: 0 | G54: =B54*0.2+C54*0.1+D54*0.2+E54*0.3+F54*0.4 -> 0
A55: 洪立哲 | B55: 49 | C55: 100 | D55: 39 | E55: 107 | F55: 70 | G55: =B55*0.2+C55*0.1+D55*0.2+E55*0.3+F55*0.4 -> 87.7