D1: 實習一 | F1: 實習二 | I1: 實習三 | L1: 實習四 | O1: 實習五 | R1: 實習六 | U1: 實習七 | X1: 總成績
B2: 學號 | C2: 期末考 | D2: DEMO | E2: 結報 | F2: 預報 | G2: DEMO | H2: 結報 | I2: 預報 | J2: DEMO | K2: 結報 | L2: 預報 | M2: DEMO | N2: 結報 | O2: 預報 | P2: DEMO | Q2: 結報 | R2: 預報 | S2: DEMO | T2: 結報 | U2: 預報 | V2: DEMO | W2: 結報
A3: 資科二 | B3: 95703042 | C3: 89 | D3: 100 | E3: 100 | F3: 100 | G3: 100 | H3: 100 | I3: 100 | J3: 98 | K3: 100 | L3: 100 | M3: 96 | N3: 100 | O3: 100 | P3: 100 | Q3: 100 | R3: 100 | S3: 100 | T3: 100 | U3: 100 | V3: 96 | W3: 100 | X3: =0.37*C3+0.045*D3+0.045*E3+(F3+G3+H3)*0.03+(I3+J3+K3)*0.03+(L3+M3+N3)*0.03+(O3+P3+Q3)*0.03+(R3+S3+T3)*0.03+(U3+V3+W3)*0.03 -> 95.63
A4: 資科二 | B4: 96703001 | C4: 62 | D4: 100 | E4: 100 | F4: 100 | G4: 100 | H4: 90 | I4: 100 | J4: 94 | K4: 100 | L4: 100 | M4: 92 | N4: 95 | O4: 100 | P4: 92 | Q4: 95 | R4: 100 | S4: 96 | T4: 100 | U4: 100 | V4: 92 | W4: 100 | X4: =0.37*C4+0.045*D4+0.045*E4+(F4+G4+H4)*0.03+(I4+J4+K4)*0.03+(L4+M4+N4)*0.03+(O4+P4+Q4)*0.03+(R4+S4+T4)*0.03+(U4+V4+W4)*0.03 -> 84.32
A5: 資科二 | B5: 96703002 | C5: 92 | D5: 100 | E5: 100 | F5: 100 | G5: 100 | H5: 100 | I5: 100 | J5: 90 | K5: 100 | L5: 100 | M5: 100 | N5: 100 | O5: 100 | P5: 84 | Q5: 100 | R5: 100 | S5: 90 | T5: 90 | U5: 100 | V5: 98 | W5: 95 | X5: =0.37*C5+0.045*D5+0.045*E5+(F5+G5+H5)*0.03+(I5+J5+K5)*0.03+(L5+M5+N5)*0.03+(O5+P5+Q5)*0.03+(R5+S5+T5)*0.03+(U5+V5+W5)*0.03 -> 95.45
A6: 資科二 | B6: 96703003 | C6: 82 | D6: 100 | E6: 100 | F6: 100 | G6: 100 | H6: 100 | I6: 100 | J6: 98 | K6: 100 | L6: 100 | M6: 96 | N6: 100 | O6: 100 | P6: 100 | Q6: 100 | R6: 100 | S6: 100 | T6: 100 | U6: 100 | V6: 96 | W6: 100 | X6: =0.37*C6+0.045*D6+0.045*E6+(F6+G6+H6)*0.03+(I6+J6+K6)*0.03+(L6+M6+N6)*0.03+(O6+P6+Q6)*0.03+(R6+S6+T6)*0.03+(U6+V6+W6)*0.03 -> 93.04
A7: 資科二 | B7: 96703004 | C7: 82 | D7: 100 | E7: 100 | F7: 100 | G7: 100 | H7: 100 | I7: 100 | J7: 96 | K7: 100 | L7: 100 | M7: 96 | N7: 100 | O7: 100 | P7: 98 | Q7: 100 | R7: 100 | S7: 92 | T7: 100 | U7: 100 | V7: 96 | W7: 100 | X7: =0.37*C7+0.045*D7+0.045*E7+(F7+G7+H7)*0.03+(I7+J7+K7)*0.03+(L7+M7+N7)*0.03+(O7+P7+Q7)*0.03+(R7+S7+T7)*0.03+(U7+V7+W7)*0.03 -> 92.68
A8: 資科二 | B8: 96703005 | C8: 66 | D8: 100 | E8: 100 | F8: 100 | G8: 100 | H8: 100 | I8: 100 | J8: 92 | K8: 100 | L8: 100 | M8: 94 | N8: 100 | O8: 100 | P8: 92 | Q8: 100 | R8: 100 | S8: 94 | T8: 100 | U8: 100 | V8: 100 | W8: 100 | X8: =0.37*C8+0.045*D8+0.045*E8+(F8+G8+H8)*0.03+(I8+J8+K8)*0.03+(L8+M8+N8)*0.03+(O8+P8+Q8)*0.03+(R8+S8+T8)*0.03+(U8+V8+W8)*0.03 -> 86.58
A9: 資科二 | B9: 96703006 | C9: 96 | D9: 100 | E9: 100 | F9: 100 | G9: 100 | H9: 90 | I9: 100 | J9: 100 | K9: 100 | L9: 100 | M9: 98 | N9: 95 | O9: 100 | P9: 94 | Q9: 80 | R9: 100 | S9: 94 | T9: 70 | U9: 100 | V9: 94 | W9: 90 | X9: =0.37*C9+0.045*D9+0.045*E9+(F9+G9+H9)*0.03+(I9+J9+K9)*0.03+(L9+M9+N9)*0.03+(O9+P9+Q9)*0.03+(R9+S9+T9)*0.03+(U9+V9+W9)*0.03 -> 95.67
A10: 資科二 | B10: 96703007 | C10: 77 | D10: 100 | E10: 100 | F10: 100 | G10: 100 | H10: 100 | I10: 100 | J10: 92 | K10: 100 | L10: 100 | M10: 94 | N10: 100 | O10: 100 | P10: 92 | Q10: 100 | R10: 100 | S10: 94 | T10: 100 | U10: 100 | V10: 100 | W10: 100 | X10: =0.37*C10+0.045*D10+0.045*E10+(F10+G10+H10)*0.03+(I10+J10+K10)*0.03+(L10+M10+N10)*0.03+(O10+P10+Q10)*0.03+(R10+S10+T10)*0.03+(U10+V10+W10)*0.03 -> 90.65
A11: 資科二 | B11: 96703008 | C11: 85 | D11: 100 | E11: 100 | F11: 100 | G11: 100 | H11: 100 | I11: 100 | J11: 90 | K11: 100 | L11: 100 | M11: 100 | N11: 100 | O11: 100 | P11: 84 | Q11: 100 | R11: 100 | S11: 90 | T11: 90 | U11: 100 | V11: 98 | W11: 95 | X11: =0.37*C11+0.045*D11+0.045*E11+(F11+G11+H11)*0.03+(I11+J11+K11)*0.03+(L11+M11+N11)*0.03+(O11+P11+Q11)*0.03+(R11+S11+T11)*0.03+(U11+V11+W11)*0.03 -> 92.86
A12: 資科二 | B12: 96703009 | C12: 74 | D12: 100 | E12: 100 | F12: 100 | G12: 100 | H12: 80 | I12: 100 | J12: 90 | K12: 100 | L12: 100 | M12: 85 | N12: 60 | O12: 100 | P12: 90 | Q12: 80 | R12: 100 | S12: 96 | T12: 100 | U12: 100 | V12: 92 | W12: 100 | X12: =0.37*C12+0.045*D12+0.045*E12+(F12+G12+H12)*0.03+(I12+J12+K12)*0.03+(L12+M12+N12)*0.03+(O12+P12+Q12)*0.03+(R12+S12+T12)*0.03+(U12+V12+W12)*0.03 -> 86.57
A13: 資科二 | B13: 96703010 | C13: 71 | D13: 100 | E13: 100 | F13: 100 | G13: 100 | H13: 90 | I13: 100 | J13: 98 | K13: 100 | L13: 100 | M13: 94 | N13: 100 | O13: 100 | P13: 96 | Q13: 60 | R13: 100 | S13: 98 | T13: 100 | U13: 100 | V13: 98 | W13: 100 | X13: =0.37*C13+0.045*D13+0.045*E13+(F13+G13+H13)*0.03+(I13+J13+K13)*0.03+(L13+M13+N13)*0.03+(O13+P13+Q13)*0.03+(R13+S13+T13)*0.03+(U13+V13+W13)*0.03 -> 87.29
A14: 資科二 | B14: 96703011 | C14: 83 | D14: 100 | E14: 100 | F14: 100 | G14: 100 | H14: 90 | I14: 100 | J14: 94 | K14: 100 | L14: 100 | M14: 92 | N14: 95 | O14: 100 | P14: 92 | Q14: 95 | R14: 100 | S14: 96 | T14: 100 | U14: 100 | V14: 92 | W14: 100 | X14: =0.37*C14+0.045*D14+0.045*E14+(F14+G14+H14)*0.03+(I14+J14+K14)*0.03+(L14+M14+N14)*0.03+(O14+P14+Q14)*0.03+(R14+S14+T14)*0.03+(U14+V14+W14)*0.03 -> 92.09
A15: 資科二 | B15: 96703014 | C15: 87 | D15: 100 | E15: 100 | F15: 100 | G15: 100 | H15: 90 | I15: 100 | J15: 100 | K15: 100 | L15: 100 | M15: 98 | N15: 95 | O15: 100 | P15: 94 | Q15: 80 | R15: 100 | S15: 94 | T15: 70 | U15: 100 | V15: 94 | W15: 90 | X15: =0.37*C15+0.045*D15+0.045*E15+(F15+G15+H15)*0.03+(I15+J15+K15)*0.03+(L15+M15+N15)*0.03+(O15+P15+Q15)*0.03+(R15+S15+T15)*0.03+(U15+V15+W15)*0.03 -> 92.34
A16: 資科二 | B16: 96703015 | C16: 91 | D16: 100 | E16: 100 | F16: 100 | G16: 100 | H16: 90 | I16: 100 | J16: 94 | K16: 100 | L16: 100 | M16: 92 | N16: 95 | O16: 100 | P16: 92 | Q16: 95 | R16: 100 | S16: 96 | T16: 100 | U16: 100 | V16: 92 | W16: 100 | X16: =0.37*C16+0.045*D16+0.045*E16+(F16+G16+H16)*0.03+(I16+J16+K16)*0.03+(L16+M16+N16)*0.03+(O16+P16+Q16)*0.03+(R16+S16+T16)*0.03+(U16+V16+W16)*0.03 -> 95.05
A17: 資科二 | B17: 96703017 | C17: 80 | D17: 100 | E17: 100 | F17: 100 | G17: 100 | H17: 80 | I17: 100 | J17: 90 | K17: 100 | L17: 100 | M17: 85 | N17: 60 | O17: 100 | P17: 90 | Q17: 80 | R17: 100 | S17: 96 | T17: 100 | U17: 100 | V17: 92 | W17: 100 | X17: =0.37*C17+0.045*D17+0.045*E17+(F17+G17+H17)*0.03+(I17+J17+K17)*0.03+(L17+M17+N17)*0.03+(O17+P17+Q17)*0.03+(R17+S17+T17)*0.03+(U17+V17+W17)*0.03 -> 88.79
A18: 資科二 | B18: 96703018 | C18: 92 | D18: 100 | E18: 100 | F18: 100 | G18: 100 | H18: 100 | I18: 100 | J18: 96 | K18: 100 | L18: 100 | M18: 98 | N18: 95 | O18: 100 | P18: 98 | Q18: 100 | R18: 100 | S18: 98 | T18: 100 | U18: 100 | V18: 90 | W18: 100 | X18: =0.37*C18+0.045*D18+0.045*E18+(F18+G18+H18)*0.03+(I18+J18+K18)*0.03+(L18+M18+N18)*0.03+(O18+P18+Q18)*0.03+(R18+S18+T18)*0.03+(U18+V18+W18)*0.03 -> 96.29
A19: 資科二 | B19: 96703019 | C19: 83 | D19: 100 | E19: 100 | F19: 100 | G19: 100 | H19: 100 | I19: 100 | J19: 96 | K19: 100 | L19: 100 | M19: 96 | N19: 100 | O19: 100 | P19: 98 | Q19: 100 | R19: 100 | S19: 92 | T19: 100 | U19: 100 | V19: 96 | W19: 100 | X19: =0.37*C19+0.045*D19+0.045*E19+(F19+G19+H19)*0.03+(I19+J19+K19)*0.03+(L19+M19+N19)*0.03+(O19+P19+Q19)*0.03+(R19+S19+T19)*0.03+(U19+V19+W19)*0.03 -> 93.05
A20: 資科二 | B20: 96703020 | C20: 84 | D20: 100 | E20: 100 | F20: 100 | G20: 100 | H20: 100 | I20: 100 | J20: 96 | K20: 100 | L20: 100 | M20: 98 | N20: 95 | O20: 100 | P20: 98 | Q20: 100 | R20: 100 | S20: 98 | T20: 100 | U20: 100 | V20: 90 | W20: 100 | X20: =0.37*C20+0.045*D20+0.045*E20+(F20+G20+H20)*0.03+(I20+J20+K20)*0.03+(L20+M20+N20)*0.03+(O20+P20+Q20)*0.03+(R20+S20+T20)*0.03+(U20+V20+W20)*0.03 -> 93.33
A21: 資科二 | B21: 96703021 | C21: 45 | D21: 100 | E21: 100 | F21: 100 | G21: 100 | H21: 90 | I21: 100 | J21: 98 | K21: 100 | L21: 100 | M21: 94 | N21: 100 | O21: 100 | P21: 96 | Q21: 60 | R21: 100 | S21: 98 | T21: 100 | U21: 100 | V21: 98 | W21: 100 | X21: =0.37*C21+0.045*D21+0.045*E21+(F21+G21+H21)*0.03+(I21+J21+K21)*0.03+(L21+M21+N21)*0.03+(O21+P21+Q21)*0.03+(R21+S21+T21)*0.03+(U21+V21+W21)*0.03 -> 77.67
A22: 資科二 | B22: 96703023 | C22: 70 | D22: 100 | E22: 100 | F22: 100 | G22: 100 | H22: 100 | I22: 100 | J22: 90 | K22: 100 | L22: 100 | M22: 85 | N22: 100 | O22: 100 | P22: 80 | Q22: 100 | R22: 100 | S22: 92 | T22: 95 | U22: 100 | V22: 80 | W22: 100 | X22: =0.37*C22+0.045*D22+0.045*E22+(F22+G22+H22)*0.03+(I22+J22+K22)*0.03+(L22+M22+N22)*0.03+(O22+P22+Q22)*0.03+(R22+S22+T22)*0.03+(U22+V22+W22)*0.03 -> 86.56
A23: 資科二 | B23: 96703024 | C23: 81 | D23: 100 | E23: 100 | F23: 100 | G23: 100 | H23: 80 | I23: 100 | J23: 90 | K23: 100 | L23: 100 | M23: 85 | N23: 60 | O23: 100 | P23: 90 | Q23: 80 | R23: 100 | S23: 96 | T23: 100 | U23: 100 | V23: 92 | W23: 100 | X23: =0.37*C23+0.045*D23+0.045*E23+(F23+G23+H23)*0.03+(I23+J23+K23)*0.03+(L23+M23+N23)*0.03+(O23+P23+Q23)*0.03+(R23+S23+T23)*0.03+(U23+V23+W23)*0.03 -> 89.16
A24: 資科二 | B24: 96703025 | C24: 0 | D24: 100 | E24: 100 | F24: 100 | G24: 100 | H24: 100 | I24: 100 | J24: 92 | K24: 100 | L24: 100 | M24: 92 | N24: 100 | O24: 100 | P24: 80 | Q24: 100 | R24: 100 | S24: 90 | T24: 95 | U24: 100 | V24: 80 | W24: 100 | X24: =0.37*C24+0.045*D24+0.045*E24+(F24+G24+H24)*0.03+(I24+J24+K24)*0.03+(L24+M24+N24)*0.03+(O24+P24+Q24)*0.03+(R24+S24+T24)*0.03+(U24+V24+W24)*0.03 -> 60.87
A25: 資科二 | B25: 96703026 | C25: 64 | D25: 100 | E25: 100 | F25: 100 | G25: 100 | H25: 100 | I25: 100 | J25: 90 | K25: 100 | L25: 100 | M25: 85 | N25: 100 | O25: 100 | P25: 80 | Q25: 100 | R25: 100 | S25: 92 | T25: 95 | U25: 100 | V25: 80 | W25: 100 | X25: =0.37*C25+0.045*D25+0.045*E25+(F25+G25+H25)*0.03+(I25+J25+K25)*0.03+(L25+M25+N25)*0.03+(O25+P25+Q25)*0.03+(R25+S25+T25)*0.03+(U25+V25+W25)*0.03 -> 84.34
A26: 資科二 | B26: 96703027 | C26: 87 | D26: 100 | E26: 100 | F26: 100 | G26: 100 | H26: 90 | I26: 100 | J26: 98 | K26: 100 | L26: 100 | M26: 94 | N26: 100 | O26: 100 | P26: 96 | Q26: 60 | R26: 100 | S26: 98 | T26: 100 | U26: 100 | V26: 98 | W26: 100 | X26: =0.37*C26+0.045*D26+0.045*E26+(F26+G26+H26)*0.03+(I26+J26+K26)*0.03+(L26+M26+N26)*0.03+(O26+P26+Q26)*0.03+(R26+S26+T26)*0.03+(U26+V26+W26)*0.03 -> 93.21
A27: 資科二 | B27: 96703028 | C27: 81 | D27: 100 | E27: 100 | F27: 100 | G27: 100 | H27: 100 | I27: 100 | J27: 92 | K27: 100 | L27: 100 | M27: 92 | N27: 100 | O27: 100 | P27: 80 | Q27: 100 | R27: 100 | S27: 90 | T27: 95 | U27: 100 | V27: 80 | W27: 100 | X27: =0.37*C27+0.045*D27+0.045*E27+(F27+G27+H27)*0.03+(I27+J27+K27)*0.03+(L27+M27+N27)*0.03+(O27+P27+Q27)*0.03+(R27+S27+T27)*0.03+(U27+V27+W27)*0.03 -> 90.84
A28: 資科二 | B28: 96703029 | C28: 55 | D28: 100 | E28: 100 | F28: 100 | G28: 100 | H28: 100 | I28: 100 | J28: 90 | K28: 100 | L28: 100 | M28: 85 | N28: 100 | O28: 100 | P28: 80 | Q28: 100 | R28: 100 | S28: 92 | T28: 95 | U28: 100 | V28: 80 | W28: 100 | X28: =0.37*C28+0.045*D28+0.045*E28+(F28+G28+H28)*0.03+(I28+J28+K28)*0.03+(L28+M28+N28)*0.03+(O28+P28+Q28)*0.03+(R28+S28+T28)*0.03+(U28+V28+W28)*0.03 -> 81.01
A29: 資科二 | B29: 96703030 | C29: 77 | D29: 100 | E29: 100 | F29: 100 | G29: 100 | H29: 90 | I29: 100 | J29: 98 | K29: 100 | L29: 100 | M29: 94 | N29: 100 | O29: 100 | P29: 96 | Q29: 60 | R29: 100 | S29: 98 | T29: 100 | U29: 100 | V29: 98 | W29: 100 | X29: =0.37*C29+0.045*D29+0.045*E29+(F29+G29+H29)*0.03+(I29+J29+K29)*0.03+(L29+M29+N29)*0.03+(O29+P29+Q29)*0.03+(R29+S29+T29)*0.03+(U29+V29+W29)*0.03 -> 89.51
A30: 資科二 | B30: 96703031 | C30: 87 | D30: 100 | E30: 100 | F30: 100 | G30: 100 | H30: 100 | I30: 100 | J30: 98 | K30: 100 | L30: 100 | M30: 96 | N30: 100 | O30: 100 | P30: 100 | Q30: 100 | R30: 100 | S30: 100 | T30: 100 | U30: 100 | V30: 96 | W30: 100 | X30: =0.37*C30+0.045*D30+0.045*E30+(F30+G30+H30)*0.03+(I30+J30+K30)*0.03+(L30+M30+N30)*0.03+(O30+P30+Q30)*0.03+(R30+S30+T30)*0.03+(U30+V30+W30)*0.03 -> 94.89
A31: 資科二 | B31: 96703032 | C31: 92 | D31: 100 | E31: 100 | F31: 100 | G31: 100 | H31: 100 | I31: 100 | J31: 96 | K31: 100 | L31: 100 | M31: 98 | N31: 95 | O31: 100 | P31: 98 | Q31: 100 | R31: 100 | S31: 98 | T31: 100 | U31: 100 | V31: 90 | W31: 100 | X31: =0.37*C31+0.045*D31+0.045*E31+(F31+G31+H31)*0.03+(I31+J31+K31)*0.03+(L31+M31+N31)*0.03+(O31+P31+Q31)*0.03+(R31+S31+T31)*0.03+(U31+V31+W31)*0.03 -> 96.29
A32: 資科二 | B32: 96703033 | C32: 82 | D32: 100 | E32: 100 | F32: 100 | G32: 100 | H32: 80 | I32: 100 | J32: 90 | K32: 100 | L32: 100 | M32: 85 | N32: 60 | O32: 100 | P32: 90 | Q32: 80 | R32: 100 | S32: 96 | T32: 100 | U32: 100 | V32: 92 | W32: 100 | X32: =0.37*C32+0.045*D32+0.045*E32+(F32+G32+H32)*0.03+(I32+J32+K32)*0.03+(L32+M32+N32)*0.03+(O32+P32+Q32)*0.03+(R32+S32+T32)*0.03+(U32+V32+W32)*0.03 -> 89.53
A33: 資科二 | B33: 96703034 | C33: 55 | D33: 100 | E33: 100 | F33: 100 | G33: 100 | H33: 100 | I33: 100 | J33: 96 | K33: 100 | L33: 100 | M33: 96 | N33: 100 | O33: 100 | P33: 98 | Q33: 100 | R33: 100 | S33: 92 | T33: 100 | U33: 100 | V33: 96 | W33: 100 | X33: =0.37*C33+0.045*D33+0.045*E33+(F33+G33+H33)*0.03+(I33+J33+K33)*0.03+(L33+M33+N33)*0.03+(O33+P33+Q33)*0.03+(R33+S33+T33)*0.03+(U33+V33+W33)*0.03 -> 82.69
A34: 資科二 | B34: 96703035 | C34: 90 | D34: 100 | E34: 100 | F34: 100 | G34: 100 | H34: 100 | I34: 100 | J34: 90 | K34: 100 | L34: 100 | M34: 100 | N34: 100 | O34: 100 | P34: 84 | Q34: 100 | R34: 100 | S34: 90 | T34: 90 | U34: 100 | V34: 98 | W34: 95 | X34: =0.37*C34+0.045*D34+0.045*E34+(F34+G34+H34)*0.03+(I34+J34+K34)*0.03+(L34+M34+N34)*0.03+(O34+P34+Q34)*0.03+(R34+S34+T34)*0.03+(U34+V34+W34)*0.03 -> 94.71
A35: 資科二 | B35: 96703036 | C35: 87 | D35: 100 | E35: 100 | F35: 100 | G35: 100 | H35: 100 | I35: 100 | J35: 90 | K35: 100 | L35: 100 | M35: 100 | N35: 100 | O35: 100 | P35: 84 | Q35: 100 | R35: 100 | S35: 90 | T35: 90 | U35: 100 | V35: 98 | W35: 95 | X35: =0.37*C35+0.045*D35+0.045*E35+(F35+G35+H35)*0.03+(I35+J35+K35)*0.03+(L35+M35+N35)*0.03+(O35+P35+Q35)*0.03+(R35+S35+T35)*0.03+(U35+V35+W35)*0.03 -> 93.6
A36: 資科二 | B36: 96703037 | C36: 82 | D36: 100 | E36: 100 | F36: 100 | G36: 100 | H36: 100 | I36: 100 | J36: 92 | K36: 100 | L36: 100 | M36: 92 | N36: 100 | O36: 100 | P36: 80 | Q36: 100 | R36: 100 | S36: 90 | T36: 95 | U36: 100 | V36: 80 | W36: 100 | X36: =0.37*C36+0.045*D36+0.045*E36+(F36+G36+H36)*0.03+(I36+J36+K36)*0.03+(L36+M36+N36)*0.03+(O36+P36+Q36)*0.03+(R36+S36+T36)*0.03+(U36+V36+W36)*0.03 -> 91.21
A37: 資科二 | B37: 96703041 | C37: 82 | D37: 100 | E37: 100 | F37: 100 | G37: 100 | H37: 100 | I37: 100 | J37: 92 | K37: 100 | L37: 100 | M37: 94 | N37: 100 | O37: 100 | P37: 92 | Q37: 100 | R37: 100 | S37: 94 | T37: 100 | U37: 100 | V37: 100 | W37: 100 | X37: =0.37*C37+0.045*D37+0.045*E37+(F37+G37+H37)*0.03+(I37+J37+K37)*0.03+(L37+M37+N37)*0.03+(O37+P37+Q37)*0.03+(R37+S37+T37)*0.03+(U37+V37+W37)*0.03 -> 92.5
A38: 資科二 | B38: 96703042 | C38: 92 | D38: 100 | E38: 100 | F38: 100 | G38: 100 | H38: 100 | I38: 100 | J38: 98 | K38: 100 | L38: 100 | M38: 96 | N38: 100 | O38: 100 | P38: 100 | Q38: 100 | R38: 100 | S38: 100 | T38: 100 | U38: 100 | V38: 96 | W38: 100 | X38: =0.37*C38+0.045*D38+0.045*E38+(F38+G38+H38)*0.03+(I38+J38+K38)*0.03+(L38+M38+N38)*0.03+(O38+P38+Q38)*0.03+(R38+S38+T38)*0.03+(U38+V38+W38)*0.03 -> 96.74
A39: 資科二 | B39: 96703045 | C39: 84 | D39: 100 | E39: 100 | F39: 100 | G39: 100 | H39: 90 | I39: 100 | J39: 94 | K39: 100 | L39: 100 | M39: 92 | N39: 95 | O39: 100 | P39: 92 | Q39: 95 | R39: 100 | S39: 96 | T39: 100 | U39: 100 | V39: 92 | W39: 100 | X39: =0.37*C39+0.045*D39+0.045*E39+(F39+G39+H39)*0.03+(I39+J39+K39)*0.03+(L39+M39+N39)*0.03+(O39+P39+Q39)*0.03+(R39+S39+T39)*0.03+(U39+V39+W39)*0.03 -> 92.46
A40: 資科二 | B40: 96703046 | C40: 78 | D40: 100 | E40: 100 | F40: 100 | G40: 100 | H40: 100 | I40: 100 | J40: 96 | K40: 100 | L40: 100 | M40: 96 | N40: 100 | O40: 100 | P40: 98 | Q40: 100 | R40: 100 | S40: 92 | T40: 100 | U40: 100 | V40: 96 | W40: 100 | X40: =0.37*C40+0.045*D40+0.045*E40+(F40+G40+H40)*0.03+(I40+J40+K40)*0.03+(L40+M40+N40)*0.03+(O40+P40+Q40)*0.03+(R40+S40+T40)*0.03+(U40+V40+W40)*0.03 -> 91.2
A41: 資科二 | B41: 96703047 | C41: 75 | D41: 100 | E41: 100 | F41: 100 | G41: 100 | H41: 100 | I41: 100 | J41: 90 | K41: 100 | L41: 100 | M41: 85 | N41: 100 | O41: 100 | P41: 80 | Q41: 100 | R41: 100 | S41: 92 | T41: 95 | U41: 100 | V41: 80 | W41: 100 | X41: =0.37*C41+0.045*D41+0.045*E41+(F41+G41+H41)*0.03+(I41+J41+K41)*0.03+(L41+M41+N41)*0.03+(O41+P41+Q41)*0.03+(R41+S41+T41)*0.03+(U41+V41+W41)*0.03 -> 88.41
A42: 資科二 | B42: 96703048 | C42: 87 | D42: 100 | E42: 100 | F42: 100 | G42: 100 | H42: 100 | I42: 100 | J42: 94 | K42: 100 | L42: 100 | M42: 90 | N42: 90 | O42: 100 | P42: 96 | Q42: 100 | R42: 100 | S42: 85 | T42: 95 | U42: 100 | V42: 94 | W42: 100 | X42: =0.37*C42+0.045*D42+0.045*E42+(F42+G42+H42)*0.03+(I42+J42+K42)*0.03+(L42+M42+N42)*0.03+(O42+P42+Q42)*0.03+(R42+S42+T42)*0.03+(U42+V42+W42)*0.03 -> 93.51
A43: 資科二 | B43: 96703049 | C43: 79 | D43: 100 | E43: 100 | F43: 100 | G43: 100 | H43: 90 | I43: 100 | J43: 100 | K43: 100 | L43: 100 | M43: 98 | N43: 95 | O43: 100 | P43: 94 | Q43: 80 | R43: 100 | S43: 94 | T43: 70 | U43: 100 | V43: 94 | W43: 90 | X43: =0.37*C43+0.045*D43+0.045*E43+(F43+G43+H43)*0.03+(I43+J43+K43)*0.03+(L43+M43+N43)*0.03+(O43+P43+Q43)*0.03+(R43+S43+T43)*0.03+(U43+V43+W43)*0.03 -> 89.38
A44: 資科二 | B44: 96703050 | C44: 70 | D44: 100 | E44: 100 | F44: 100 | G44: 100 | H44: 100 | I44: 100 | J44: 94 | K44: 100 | L44: 100 | M44: 90 | N44: 90 | O44: 100 | P44: 96 | Q44: 100 | R44: 100 | S44: 85 | T44: 95 | U44: 100 | V44: 94 | W44: 100 | X44: =0.37*C44+0.045*D44+0.045*E44+(F44+G44+H44)*0.03+(I44+J44+K44)*0.03+(L44+M44+N44)*0.03+(O44+P44+Q44)*0.03+(R44+S44+T44)*0.03+(U44+V44+W44)*0.03 -> 87.22
A45: 資科二 | B45: 96703052 | C45: 88 | D45: 100 | E45: 100 | F45: 100 | G45: 100 | H45: 100 | I45: 100 | J45: 94 | K45: 100 | L45: 100 | M45: 90 | N45: 90 | O45: 100 | P45: 96 | Q45: 100 | R45: 100 | S45: 85 | T45: 95 | U45: 100 | V45: 94 | W45: 100 | X45: =0.37*C45+0.045*D45+0.045*E45+(F45+G45+H45)*0.03+(I45+J45+K45)*0.03+(L45+M45+N45)*0.03+(O45+P45+Q45)*0.03+(R45+S45+T45)*0.03+(U45+V45+W45)*0.03 -> 93.88
A46: 資科二 | B46: 96703053 | C46: 82 | D46: 100 | E46: 100 | F46: 100 | G46: 100 | H46: 100 | I46: 100 | J46: 92 | K46: 100 | L46: 100 | M46: 94 | N46: 100 | O46: 100 | P46: 92 | Q46: 100 | R46: 100 | S46: 94 | T46: 100 | U46: 100 | V46: 100 | W46: 100 | X46: =0.37*C46+0.045*D46+0.045*E46+(F46+G46+H46)*0.03+(I46+J46+K46)*0.03+(L46+M46+N46)*0.03+(O46+P46+Q46)*0.03+(R46+S46+T46)*0.03+(U46+V46+W46)*0.03 -> 92.5
A47: 資科二 | B47: 96703054 | C47: 86 | D47: 100 | E47: 100 | F47: 100 | G47: 100 | H47: 100 | I47: 100 | J47: 92 | K47: 100 | L47: 100 | M47: 92 | N47: 100 | O47: 100 | P47: 80 | Q47: 100 | R47: 100 | S47: 90 | T47: 95 | U47: 100 | V47: 80 | W47: 100 | X47: =0.37*C47+0.045*D47+0.045*E47+(F47+G47+H47)*0.03+(I47+J47+K47)*0.03+(L47+M47+N47)*0.03+(O47+P47+Q47)*0.03+(R47+S47+T47)*0.03+(U47+V47+W47)*0.03 -> 92.69
A48: 資科二 | B48: 96703055 | C48: 92 | D48: 100 | E48: 100 | F48: 100 | G48: 100 | H48: 100 | I48: 100 | J48: 94 | K48: 100 | L48: 100 | M48: 90 | N48: 90 | O48: 100 | P48: 96 | Q48: 100 | R48: 100 | S48: 85 | T48: 95 | U48: 100 | V48: 94 | W48: 100 | X48: =0.37*C48+0.045*D48+0.045*E48+(F48+G48+H48)*0.03+(I48+J48+K48)*0.03+(L48+M48+N48)*0.03+(O48+P48+Q48)*0.03+(R48+S48+T48)*0.03+(U48+V48+W48)*0.03 -> 95.36
A49: 資科二 | B49: 96703056 | C49: 82 | D49: 100 | E49: 100 | F49: 100 | G49: 100 | H49: 90 | I49: 100 | J49: 100 | K49: 100 | L49: 100 | M49: 98 | N49: 95 | O49: 100 | P49: 94 | Q49: 80 | R49: 100 | S49: 94 | T49: 70 | U49: 100 | V49: 94 | W49: 90 | X49: =0.37*C49+0.045*D49+0.045*E49+(F49+G49+H49)*0.03+(I49+J49+K49)*0.03+(L49+M49+N49)*0.03+(O49+P49+Q49)*0.03+(R49+S49+T49)*0.03+(U49+V49+W49)*0.03 -> 90.49