A1: 學號 | B1: 組別 | C1: DEMO | D1: 結報 | E1: 預報 | F1: DEMO | G1: 結報 | H1: 預報 | I1: DEMO | J1: 結報 | K1: 預報 | L1: DEMO | M1: 結報 | N1: 預報 | O1: DEMO | P1: 結報 | Q1: 預報 | R1: DEMO | S1: 結報 | T1: 預報 | U1: DEMO | V1: 結報 | W1: 期末考 | X1: 總成績
A2: 94703041 | B2: 1 | C2: 98 | D2: 90 | E2: 100 | F2: 92 | G2: 100 | H2: 100 | I2: 92 | J2: 100 | K2: 100 | L2: 95 | M2: 100 | N2: 100 | O2: 84 | P2: 95 | Q2: 100 | R2: 95 | S2: 90 | T2: 100 | U2: 98 | V2: 100 | W2: 80 | X2: =(C2+D2)*0.05+(E2+F2+G2)/30+(H2+I2+J2)/30+(K2+L2+M2)/30+(N2+O2+P2)/30+(Q2+R2+S2)/30+(T2+U2+V2)/30+W2*0.3 -> 91.433333333333337
A3: 94703043 | B3: 1 | C3: 98 | D3: 90 | E3: 100 | F3: 92 | G3: 100 | H3: 100 | I3: 92 | J3: 100 | K3: 100 | L3: 95 | M3: 100 | N3: 100 | O3: 84 | P3: 95 | Q3: 100 | R3: 95 | S3: 90 | T3: 100 | U3: 98 | V3: 100 | W3: 60 | X3: =(C3+D3)*0.05+(E3+F3+G3)/30+(H3+I3+J3)/30+(K3+L3+M3)/30+(N3+O3+P3)/30+(Q3+R3+S3)/30+(T3+U3+V3)/30+W3*0.3 -> 85.433333333333337
A4: 95703026 | B4: 1 | C4: 98 | D4: 90 | E4: 100 | F4: 92 | G4: 100 | H4: 100 | I4: 92 | J4: 100 | K4: 100 | L4: 95 | M4: 100 | N4: 100 | O4: 84 | P4: 95 | Q4: 100 | R4: 95 | S4: 90 | T4: 100 | U4: 98 | V4: 100 | W4: 80 | X4: =(C4+D4)*0.05+(E4+F4+G4)/30+(H4+I4+J4)/30+(K4+L4+M4)/30+(N4+O4+P4)/30+(Q4+R4+S4)/30+(T4+U4+V4)/30+W4*0.3 -> 91.433333333333337
A5: 95703038 | B5: 1 | C5: 98 | D5: 90 | E5: 100 | F5: 92 | G5: 100 | H5: 100 | I5: 92 | J5: 100 | K5: 100 | L5: 95 | M5: 100 | N5: 100 | O5: 84 | P5: 95 | Q5: 100 | R5: 95 | S5: 90 | T5: 100 | U5: 98 | V5: 100 | W5: 80 | X5: =(C5+D5)*0.05+(E5+F5+G5)/30+(H5+I5+J5)/30+(K5+L5+M5)/30+(N5+O5+P5)/30+(Q5+R5+S5)/30+(T5+U5+V5)/30+W5*0.3 -> 91.433333333333337
A6: 95703013 | B6: 2 | C6: 97 | D6: 100 | E6: 100 | F6: 93 | G6: 100 | H6: 100 | I6: 93 | J6: 100 | K6: 100 | L6: 100 | M6: 90 | N6: 100 | O6: 85 | P6: 100 | Q6: 100 | R6: 96 | S6: 100 | T6: 100 | U6: 97 | V6: 95 | W6: 35 | X6: =(C6+D6)*0.05+(E6+F6+G6)/30+(H6+I6+J6)/30+(K6+L6+M6)/30+(N6+O6+P6)/30+(Q6+R6+S6)/30+(T6+U6+V6)/30+W6*0.3 -> 78.65
A7: 95703014 | B7: 2 | C7: 97 | D7: 100 | E7: 100 | F7: 93 | G7: 100 | H7: 100 | I7: 93 | J7: 100 | K7: 100 | L7: 100 | M7: 90 | N7: 100 | O7: 85 | P7: 100 | Q7: 100 | R7: 96 | S7: 100 | T7: 100 | U7: 97 | V7: 95 | W7: 40 | X7: =(C7+D7)*0.05+(E7+F7+G7)/30+(H7+I7+J7)/30+(K7+L7+M7)/30+(N7+O7+P7)/30+(Q7+R7+S7)/30+(T7+U7+V7)/30+W7*0.3 -> 80.15
A8: 95703036 | B8: 2 | C8: 97 | D8: 100 | E8: 100 | F8: 93 | G8: 100 | H8: 100 | I8: 93 | J8: 100 | K8: 100 | L8: 100 | M8: 90 | N8: 100 | O8: 85 | P8: 100 | Q8: 100 | R8: 96 | S8: 100 | T8: 100 | U8: 97 | V8: 95 | W8: 65 | X8: =(C8+D8)*0.05+(E8+F8+G8)/30+(H8+I8+J8)/30+(K8+L8+M8)/30+(N8+O8+P8)/30+(Q8+R8+S8)/30+(T8+U8+V8)/30+W8*0.3 -> 87.65
A9: 95703037 | B9: 2 | C9: 97 | D9: 100 | E9: 100 | F9: 93 | G9: 100 | H9: 100 | I9: 93 | J9: 100 | K9: 100 | L9: 100 | M9: 90 | N9: 100 | O9: 85 | P9: 100 | Q9: 100 | R9: 96 | S9: 100 | T9: 100 | U9: 97 | V9: 95 | W9: 60 | X9: =(C9+D9)*0.05+(E9+F9+G9)/30+(H9+I9+J9)/30+(K9+L9+M9)/30+(N9+O9+P9)/30+(Q9+R9+S9)/30+(T9+U9+V9)/30+W9*0.3 -> 86.15
A10: 95703017 | B10: 3 | C10: 97 | D10: 100 | E10: 100 | F10: 88 | G10: 100 | H10: 100 | I10: 88 | J10: 100 | K10: 100 | L10: 93 | M10: 90 | N10: 100 | O10: 91 | P10: 90 | Q10: 100 | R10: 92 | S10: 95 | T10: 100 | U10: 92 | V10: 95 | W10: 75 | X10: =(C10+D10)*0.05+(E10+F10+G10)/30+(H10+I10+J10)/30+(K10+L10+M10)/30+(N10+O10+P10)/30+(Q10+R10+S10)/30+(T10+U10+V10)/30+W10*0.3 -> 89.483333333333334
A11: 95703018 | B11: 3 | C11: 97 | D11: 100 | E11: 100 | F11: 88 | G11: 100 | H11: 100 | I11: 88 | J11: 100 | K11: 100 | L11: 93 | M11: 90 | N11: 100 | O11: 91 | P11: 90 | Q11: 100 | R11: 92 | S11: 95 | T11: 100 | U11: 92 | V11: 95 | W11: 45 | X11: =(C11+D11)*0.05+(E11+F11+G11)/30+(H11+I11+J11)/30+(K11+L11+M11)/30+(N11+O11+P11)/30+(Q11+R11+S11)/30+(T11+U11+V11)/30+W11*0.3 -> 80.483333333333334
A12: 95703022 | B12: 3 | C12: 97 | D12: 100 | E12: 100 | F12: 88 | G12: 100 | H12: 100 | I12: 88 | J12: 100 | K12: 100 | L12: 93 | M12: 90 | N12: 100 | O12: 91 | P12: 90 | Q12: 100 | R12: 92 | S12: 95 | T12: 100 | U12: 92 | V12: 95 | W12: 75 | X12: =(C12+D12)*0.05+(E12+F12+G12)/30+(H12+I12+J12)/30+(K12+L12+M12)/30+(N12+O12+P12)/30+(Q12+R12+S12)/30+(T12+U12+V12)/30+W12*0.3 -> 89.483333333333334
A13: 95703024 | B13: 3 | C13: 97 | D13: 100 | E13: 100 | F13: 88 | G13: 100 | H13: 100 | I13: 88 | J13: 100 | K13: 100 | L13: 93 | M13: 90 | N13: 100 | O13: 91 | P13: 90 | Q13: 100 | R13: 92 | S13: 95 | T13: 100 | U13: 92 | V13: 95 | W13: 70 | X13: =(C13+D13)*0.05+(E13+F13+G13)/30+(H13+I13+J13)/30+(K13+L13+M13)/30+(N13+O13+P13)/30+(Q13+R13+S13)/30+(T13+U13+V13)/30+W13*0.3 -> 87.983333333333334
A14: 95703049 | B14: 4 | C14: 93 | D14: 100 | E14: 100 | F14: 92 | G14: 100 | H14: 100 | I14: 92 | J14: 100 | K14: 100 | L14: 97 | M14: 95 | N14: 100 | O14: 81 | P14: 100 | Q14: 100 | R14: 94 | S14: 100 | T14: 100 | U14: 94 | V14: 90 | W14: 20 | X14: =(C14+D14)*0.05+(E14+F14+G14)/30+(H14+I14+J14)/30+(K14+L14+M14)/30+(N14+O14+P14)/30+(Q14+R14+S14)/30+(T14+U14+V14)/30+W14*0.3 -> 73.483333333333334
A15: 95703051 | B15: 4 | C15: 93 | D15: 100 | E15: 100 | F15: 92 | G15: 100 | H15: 100 | I15: 92 | J15: 100 | K15: 100 | L15: 97 | M15: 95 | N15: 100 | O15: 81 | P15: 100 | Q15: 100 | R15: 94 | S15: 100 | T15: 100 | U15: 94 | V15: 90 | W15: 90 | X15: =(C15+D15)*0.05+(E15+F15+G15)/30+(H15+I15+J15)/30+(K15+L15+M15)/30+(N15+O15+P15)/30+(Q15+R15+S15)/30+(T15+U15+V15)/30+W15*0.3 -> 94.483333333333334
A16: 95703052 | B16: 4 | C16: 93 | D16: 100 | E16: 100 | F16: 92 | G16: 100 | H16: 100 | I16: 92 | J16: 100 | K16: 100 | L16: 97 | M16: 95 | N16: 100 | O16: 81 | P16: 100 | Q16: 100 | R16: 94 | S16: 100 | T16: 100 | U16: 94 | V16: 90 | W16: 95 | X16: =(C16+D16)*0.05+(E16+F16+G16)/30+(H16+I16+J16)/30+(K16+L16+M16)/30+(N16+O16+P16)/30+(Q16+R16+S16)/30+(T16+U16+V16)/30+W16*0.3 -> 95.983333333333334
A17: 95703055 | B17: 4 | C17: 93 | D17: 100 | E17: 100 | F17: 92 | G17: 100 | H17: 100 | I17: 92 | J17: 100 | K17: 100 | L17: 97 | M17: 95 | N17: 100 | O17: 81 | P17: 100 | Q17: 100 | R17: 94 | S17: 100 | T17: 100 | U17: 94 | V17: 90 | W17: 85 | X17: =(C17+D17)*0.05+(E17+F17+G17)/30+(H17+I17+J17)/30+(K17+L17+M17)/30+(N17+O17+P17)/30+(Q17+R17+S17)/30+(T17+U17+V17)/30+W17*0.3 -> 92.983333333333334
A18: 95703007 | B18: 5 | C18: 94 | D18: 100 | E18: 100 | F18: 96 | G18: 100 | H18: 100 | I18: 96 | J18: 100 | K18: 100 | L18: 92 | M18: 90 | N18: 100 | O18: 96 | P18: 100 | Q18: 100 | R18: 100 | S18: 100 | T18: 90 | U18: 93 | V18: 95 | W18: 70 | X18: =(C18+D18)*0.05+(E18+F18+G18)/30+(H18+I18+J18)/30+(K18+L18+M18)/30+(N18+O18+P18)/30+(Q18+R18+S18)/30+(T18+U18+V18)/30+W18*0.3 -> 88.966666666666669
A19: 95703009 | B19: 5 | C19: 94 | D19: 100 | E19: 100 | F19: 96 | G19: 100 | H19: 100 | I19: 96 | J19: 100 | K19: 100 | L19: 92 | M19: 90 | N19: 100 | O19: 96 | P19: 100 | Q19: 100 | R19: 100 | S19: 100 | T19: 90 | U19: 93 | V19: 95 | W19: 70 | X19: =(C19+D19)*0.05+(E19+F19+G19)/30+(H19+I19+J19)/30+(K19+L19+M19)/30+(N19+O19+P19)/30+(Q19+R19+S19)/30+(T19+U19+V19)/30+W19*0.3 -> 88.966666666666669
A20: 95703015 | B20: 5 | C20: 94 | D20: 100 | E20: 100 | F20: 96 | G20: 100 | H20: 100 | I20: 96 | J20: 100 | K20: 100 | L20: 92 | M20: 90 | N20: 100 | O20: 96 | P20: 100 | Q20: 100 | R20: 100 | S20: 100 | T20: 90 | U20: 93 | V20: 95 | W20: 65 | X20: =(C20+D20)*0.05+(E20+F20+G20)/30+(H20+I20+J20)/30+(K20+L20+M20)/30+(N20+O20+P20)/30+(Q20+R20+S20)/30+(T20+U20+V20)/30+W20*0.3 -> 87.466666666666669
A21: 95703016 | B21: 5 | C21: 94 | D21: 100 | E21: 100 | F21: 96 | G21: 100 | H21: 100 | I21: 96 | J21: 100 | K21: 100 | L21: 92 | M21: 90 | N21: 100 | O21: 96 | P21: 100 | Q21: 100 | R21: 100 | S21: 100 | T21: 90 | U21: 93 | V21: 95 | W21: 50 | X21: =(C21+D21)*0.05+(E21+F21+G21)/30+(H21+I21+J21)/30+(K21+L21+M21)/30+(N21+O21+P21)/30+(Q21+R21+S21)/30+(T21+U21+V21)/30+W21*0.3 -> 82.966666666666669
A22: 95703012 | B22: 6 | C22: 96 | D22: 100 | E22: 100 | F22: 96 | G22: 100 | H22: 100 | I22: 96 | J22: 100 | K22: 100 | L22: 99 | M22: 100 | N22: 95 | O22: 81 | P22: 100 | Q22: 100 | R22: 70 | S22: 100 | T22: 90 | U22: 80 | V22: 100 | W22: 65 | X22: =(C22+D22)*0.05+(E22+F22+G22)/30+(H22+I22+J22)/30+(K22+L22+M22)/30+(N22+O22+P22)/30+(Q22+R22+S22)/30+(T22+U22+V22)/30+W22*0.3 -> 86.2
A23: 95703019 | B23: 6 | C23: 96 | D23: 100 | E23: 100 | F23: 96 | G23: 100 | H23: 100 | I23: 96 | J23: 100 | K23: 100 | L23: 99 | M23: 100 | N23: 95 | O23: 81 | P23: 100 | Q23: 100 | R23: 70 | S23: 100 | T23: 90 | U23: 80 | V23: 100 | W23: 60 | X23: =(C23+D23)*0.05+(E23+F23+G23)/30+(H23+I23+J23)/30+(K23+L23+M23)/30+(N23+O23+P23)/30+(Q23+R23+S23)/30+(T23+U23+V23)/30+W23*0.3 -> 84.7
A24: 95703020 | B24: 6 | C24: 96 | D24: 100 | E24: 100 | F24: 96 | G24: 100 | H24: 100 | I24: 96 | J24: 100 | K24: 100 | L24: 99 | M24: 100 | N24: 95 | O24: 81 | P24: 100 | Q24: 100 | R24: 70 | S24: 100 | T24: 90 | U24: 80 | V24: 100 | W24: 30 | X24: =(C24+D24)*0.05+(E24+F24+G24)/30+(H24+I24+J24)/30+(K24+L24+M24)/30+(N24+O24+P24)/30+(Q24+R24+S24)/30+(T24+U24+V24)/30+W24*0.3 -> 75.7
A25: 95703027 | B25: 6 | C25: 96 | D25: 100 | E25: 100 | F25: 96 | G25: 100 | H25: 100 | I25: 96 | J25: 100 | K25: 100 | L25: 99 | M25: 100 | N25: 95 | O25: 81 | P25: 100 | Q25: 100 | R25: 70 | S25: 100 | T25: 90 | U25: 80 | V25: 100 | W25: 60 | X25: =(C25+D25)*0.05+(E25+F25+G25)/30+(H25+I25+J25)/30+(K25+L25+M25)/30+(N25+O25+P25)/30+(Q25+R25+S25)/30+(T25+U25+V25)/30+W25*0.3 -> 84.7
A26: 95703001 | B26: 7 | C26: 100 | D26: 100 | E26: 100 | F26: 95 | G26: 100 | H26: 100 | I26: 95 | J26: 100 | K26: 100 | L26: 96 | M26: 100 | N26: 90 | O26: 96 | P26: 100 | Q26: 100 | R26: 93 | S26: 100 | T26: 100 | U26: 95 | V26: 95 | W26: 80 | X26: =(C26+D26)*0.05+(E26+F26+G26)/30+(H26+I26+J26)/30+(K26+L26+M26)/30+(N26+O26+P26)/30+(Q26+R26+S26)/30+(T26+U26+V26)/30+W26*0.3 -> 92.5
A27: 95703006 | B27: 7 | C27: 100 | D27: 100 | E27: 100 | F27: 95 | G27: 100 | H27: 100 | I27: 95 | J27: 100 | K27: 100 | L27: 96 | M27: 100 | N27: 90 | O27: 96 | P27: 100 | Q27: 100 | R27: 93 | S27: 100 | T27: 100 | U27: 95 | V27: 95 | W27: 55 | X27: =(C27+D27)*0.05+(E27+F27+G27)/30+(H27+I27+J27)/30+(K27+L27+M27)/30+(N27+O27+P27)/30+(Q27+R27+S27)/30+(T27+U27+V27)/30+W27*0.3 -> 85
A28: 95703031 | B28: 7 | C28: 100 | D28: 100 | E28: 100 | F28: 95 | G28: 100 | H28: 100 | I28: 95 | J28: 100 | K28: 100 | L28: 96 | M28: 100 | N28: 90 | O28: 96 | P28: 100 | Q28: 100 | R28: 93 | S28: 100 | T28: 100 | U28: 95 | V28: 95 | W28: 70 | X28: =(C28+D28)*0.05+(E28+F28+G28)/30+(H28+I28+J28)/30+(K28+L28+M28)/30+(N28+O28+P28)/30+(Q28+R28+S28)/30+(T28+U28+V28)/30+W28*0.3 -> 89.5
A29: 95703041 | B29: 7 | C29: 100 | D29: 100 | E29: 100 | F29: 95 | G29: 100 | H29: 100 | I29: 95 | J29: 100 | K29: 100 | L29: 96 | M29: 100 | N29: 90 | O29: 96 | P29: 100 | Q29: 100 | R29: 93 | S29: 100 | T29: 100 | U29: 95 | V29: 95 | W29: 65 | X29: =(C29+D29)*0.05+(E29+F29+G29)/30+(H29+I29+J29)/30+(K29+L29+M29)/30+(N29+O29+P29)/30+(Q29+R29+S29)/30+(T29+U29+V29)/30+W29*0.3 -> 88
A30: 95703003 | B30: 8 | C30: 91 | D30: 100 | E30: 100 | F30: 94 | G30: 100 | H30: 100 | I30: 94 | J30: 100 | K30: 100 | L30: 94 | M30: 95 | N30: 100 | O30: 100 | P30: 100 | Q30: 100 | R30: 97 | S30: 100 | T30: 95 | U30: 99 | V30: 90 | W30: 70 | X30: =(C30+D30)*0.05+(E30+F30+G30)/30+(H30+I30+J30)/30+(K30+L30+M30)/30+(N30+O30+P30)/30+(Q30+R30+S30)/30+(T30+U30+V30)/30+W30*0.3 -> 89.15
A31: 95703030 | B31: 8 | C31: 91 | D31: 100 | E31: 100 | F31: 94 | G31: 100 | H31: 100 | I31: 94 | J31: 100 | K31: 100 | L31: 94 | M31: 95 | N31: 100 | O31: 100 | P31: 100 | Q31: 100 | R31: 97 | S31: 100 | T31: 95 | U31: 99 | V31: 90 | W31: 75 | X31: =(C31+D31)*0.05+(E31+F31+G31)/30+(H31+I31+J31)/30+(K31+L31+M31)/30+(N31+O31+P31)/30+(Q31+R31+S31)/30+(T31+U31+V31)/30+W31*0.3 -> 90.65
A32: 95703035 | B32: 8 | C32: 91 | D32: 100 | E32: 100 | F32: 94 | G32: 100 | H32: 100 | I32: 94 | J32: 100 | K32: 100 | L32: 94 | M32: 95 | N32: 100 | O32: 100 | P32: 100 | Q32: 100 | R32: 97 | S32: 100 | T32: 95 | U32: 99 | V32: 90 | W32: 75 | X32: =(C32+D32)*0.05+(E32+F32+G32)/30+(H32+I32+J32)/30+(K32+L32+M32)/30+(N32+O32+P32)/30+(Q32+R32+S32)/30+(T32+U32+V32)/30+W32*0.3 -> 90.65
A33: 95703044 | B33: 8 | C33: 91 | D33: 100 | E33: 100 | F33: 94 | G33: 100 | H33: 100 | I33: 94 | J33: 100 | K33: 100 | L33: 94 | M33: 95 | N33: 100 | O33: 100 | P33: 100 | Q33: 100 | R33: 97 | S33: 100 | T33: 95 | U33: 99 | V33: 90 | W33: 70 | X33: =(C33+D33)*0.05+(E33+F33+G33)/30+(H33+I33+J33)/30+(K33+L33+M33)/30+(N33+O33+P33)/30+(Q33+R33+S33)/30+(T33+U33+V33)/30+W33*0.3 -> 89.15
A34: 95703010 | B34: 9 | C34: 91 | D34: 100 | E34: 100 | F34: 93 | G34: 100 | H34: 100 | I34: 93 | J34: 100 | K34: 100 | L34: 91 | M34: 90 | N34: 100 | O34: 82 | P34: 90 | Q34: 100 | R34: 99 | S34: 100 | T34: 100 | U34: 96 | V34: 95 | W34: 80 | X34: =(C34+D34)*0.05+(E34+F34+G34)/30+(H34+I34+J34)/30+(K34+L34+M34)/30+(N34+O34+P34)/30+(Q34+R34+S34)/30+(T34+U34+V34)/30+W34*0.3 -> 91.183333333333337
A35: 95703033 | B35: 9 | C35: 91 | D35: 100 | E35: 100 | F35: 93 | G35: 100 | H35: 100 | I35: 93 | J35: 100 | K35: 100 | L35: 91 | M35: 90 | N35: 100 | O35: 82 | P35: 90 | Q35: 100 | R35: 99 | S35: 100 | T35: 100 | U35: 96 | V35: 95 | W35: 70 | X35: =(C35+D35)*0.05+(E35+F35+G35)/30+(H35+I35+J35)/30+(K35+L35+M35)/30+(N35+O35+P35)/30+(Q35+R35+S35)/30+(T35+U35+V35)/30+W35*0.3 -> 88.183333333333337
A36: 95703046 | B36: 9 | C36: 91 | D36: 100 | E36: 100 | F36: 93 | G36: 100 | H36: 100 | I36: 93 | J36: 100 | K36: 100 | L36: 91 | M36: 90 | N36: 100 | O36: 82 | P36: 90 | Q36: 100 | R36: 99 | S36: 100 | T36: 100 | U36: 96 | V36: 95 | W36: 80 | X36: =(C36+D36)*0.05+(E36+F36+G36)/30+(H36+I36+J36)/30+(K36+L36+M36)/30+(N36+O36+P36)/30+(Q36+R36+S36)/30+(T36+U36+V36)/30+W36*0.3 -> 91.183333333333337
A37: 95703047 | B37: 9 | C37: 91 | D37: 100 | E37: 100 | F37: 93 | G37: 100 | H37: 100 | I37: 93 | J37: 100 | K37: 100 | L37: 91 | M37: 90 | N37: 100 | O37: 82 | P37: 90 | Q37: 100 | R37: 99 | S37: 100 | T37: 100 | U37: 96 | V37: 95 | W37: 70 | X37: =(C37+D37)*0.05+(E37+F37+G37)/30+(H37+I37+J37)/30+(K37+L37+M37)/30+(N37+O37+P37)/30+(Q37+R37+S37)/30+(T37+U37+V37)/30+W37*0.3 -> 88.183333333333337
A38: 95703025 | B38: 10 | C38: 95 | D38: 100 | E38: 100 | F38: 95 | G38: 100 | H38: 100 | I38: 95 | J38: 100 | K38: 100 | L38: 98 | M38: 100 | N38: 100 | O38: 80 | P38: 95 | Q38: 100 | R38: 98 | S38: 90 | T38: 100 | U38: 100 | V38: 100 | W38: 65 | X38: =(C38+D38)*0.05+(E38+F38+G38)/30+(H38+I38+J38)/30+(K38+L38+M38)/30+(N38+O38+P38)/30+(Q38+R38+S38)/30+(T38+U38+V38)/30+W38*0.3 -> 87.616666666666674
A39: 95703028 | B39: 10 | C39: 95 | D39: 100 | E39: 100 | F39: 95 | G39: 100 | H39: 100 | I39: 95 | J39: 100 | K39: 100 | L39: 98 | M39: 100 | N39: 100 | O39: 80 | P39: 95 | Q39: 100 | R39: 98 | S39: 90 | T39: 100 | U39: 100 | V39: 100 | W39: 75 | X39: =(C39+D39)*0.05+(E39+F39+G39)/30+(H39+I39+J39)/30+(K39+L39+M39)/30+(N39+O39+P39)/30+(Q39+R39+S39)/30+(T39+U39+V39)/30+W39*0.3 -> 90.616666666666674
A40: 95703043 | B40: 10 | C40: 95 | D40: 100 | E40: 100 | F40: 95 | G40: 100 | H40: 100 | I40: 95 | J40: 100 | K40: 100 | L40: 98 | M40: 100 | N40: 100 | O40: 80 | P40: 95 | Q40: 100 | R40: 98 | S40: 90 | T40: 100 | U40: 100 | V40: 100 | W40: 60 | X40: =(C40+D40)*0.05+(E40+F40+G40)/30+(H40+I40+J40)/30+(K40+L40+M40)/30+(N40+O40+P40)/30+(Q40+R40+S40)/30+(T40+U40+V40)/30+W40*0.3 -> 86.116666666666674
A41: 95703045 | B41: 10 | C41: 95 | D41: 100 | E41: 100 | F41: 95 | G41: 100 | H41: 100 | I41: 95 | J41: 100 | K41: 100 | L41: 98 | M41: 100 | N41: 100 | O41: 80 | P41: 95 | Q41: 100 | R41: 98 | S41: 90 | T41: 100 | U41: 100 | V41: 100 | W41: 60 | X41: =(C41+D41)*0.05+(E41+F41+G41)/30+(H41+I41+J41)/30+(K41+L41+M41)/30+(N41+O41+P41)/30+(Q41+R41+S41)/30+(T41+U41+V41)/30+W41*0.3 -> 86.116666666666674